item,,,,,,,,,,,,,,,,,,,,,,,,,,,,,
May the fire of love and the passion of water fill up your life with the smoke of happiness. Hv a great crazy fiery bday,,,,,,,,,,,,,,,,,,,,,,,,,,,,,
This bday wish goes for the hottest grl in town for her coolness,,,,,,,,,,,,,,,,,,,,,,,,,,,,,
Let the fire in you take ur spirits up to ocean this bday,,,,,,,,,,,,,,,,,,,,,,,,,,,,,
,,,,,,,,,,,,,,,,,,,,,,,,,,,,,
Happy bday you fiery girl,,,,,,,,,,,,,,,,,,,,,,,,,,,,,
May the gods of love n lust bestow upon you the fire n water of happiness and fun this bday,,,,,,,,,,,,,,,,,,,,,,,,,,,,,
"50 fires, 50 birthdays!",,,,,,,,,,,,,,,,,,,,,,,,,,,,,
You are the quench to my fire. Happy birthday!,,,,,,,,,,,,,,,,,,,,,,,,,,,,,
50 years of putting out fires ~ happy birthday Mary!,,,,,,,,,,,,,,,,,,,,,,,,,,,,,
"Happy birthday, fire queen!",,,,,,,,,,,,,,,,,,,,,,,,,,,,,
Mary a firefighter and you'll always be safe. =p Happy birthday to my dear wife!,,,,,,,,,,,,,,,,,,,,,,,,,,,,,
Happy birthday to the smokiest gal I know!,,,,,,,,,,,,,,,,,,,,,,,,,,,,,
Happy half-century!,,,,,,,,,,,,,,,,,,,,,,,,,,,,,
Wish you save many more lives :),,,,,,,,,,,,,,,,,,,,,,,,,,,,,
"iIf not for you, just think how many would have perished.",,,,,,,,,,,,,,,,,,,,,,,,,,,,,
"Wish you to remain triumphant over any fire, no matter how big.",,,,,,,,,,,,,,,,,,,,,,,,,,,,,
I hope no one will need your services this year!,,,,,,,,,,,,,,,,,,,,,,,,,,,,,
"Happy Birthday, girl on fire!",,,,,,,,,,,,,,,,,,,,,,,,,,,,,
I wish you a safe year :),,,,,,,,,,,,,,,,,,,,,,,,,,,,,
Almost done with saving,,,,,,,,,,,,,,,,,,,,,,,,,,,,,
happy 50th mary the firefighter!,,,,,,,,,,,,,,,,,,,,,,,,,,,,,
ur 50! woo hoo!,,,,,,,,,,,,,,,,,,,,,,,,,,,,,
saved any kittens lately? happy birthday firefighter,,,,,,,,,,,,,,,,,,,,,,,,,,,,,
happy 50th!,,,,,,,,,,,,,,,,,,,,,,,,,,,,,
5+0=5. 5alarm fire?! idk. happy bday,,,,,,,,,,,,,,,,,,,,,,,,,,,,,
[picture of bday cake with 50 candles] is this a fire hazard? good thing you will be on hand! happy 50th!,,,,,,,,,,,,,,,,,,,,,,,,,,,,,
u r kewl have a good bday,,,,,,,,,,,,,,,,,,,,,,,,,,,,,
Mary the most awesome of all,,,,,,,,,,,,,,,,,,,,,,,,,,,,,
Mary the most awesome firefighter of all,,,,,,,,,,,,,,,,,,,,,,,,,,,,,
"Mary, the woman firefighter over a crowd of men",,,,,,,,,,,,,,,,,,,,,,,,,,,,,
"So Happy to have you, Mary!",,,,,,,,,,,,,,,,,,,,,,,,,,,,,
Mary wishing you all the best,,,,,,,,,,,,,,,,,,,,,,,,,,,,,
A Happy New Decade to Mary the Firefighter,,,,,,,,,,,,,,,,,,,,,,,,,,,,,
"Mary, half way into her life and still not stopping saving lives",,,,,,,,,,,,,,,,,,,,,,,,,,,,,
Happy Birthday Mary,,,,,,,,,,,,,,,,,,,,,,,,,,,,,
Another year you can look hot in red.,,,,,,,,,,,,,,,,,,,,,,,,,,,,,
Another fire out. Enjoy it anyway.,,,,,,,,,,,,,,,,,,,,,,,,,,,,,
Another pole to climb down. Enjoy your day.,,,,,,,,,,,,,,,,,,,,,,,,,,,,,
"For your birthday I thought I would gift you a fireman getting his clothes off....

Inside card an image of fireman taking washing off tge line",,,,,,,,,,,,,,,,,,,,,,,,,,,,,
Happy birthday from all tge families you have saved.,,,,,,,,,,,,,,,,,,,,,,,,,,,,,
Happy birthday from all of us at tge brigade,,,,,,,,,,,,,,,,,,,,,,,,,,,,,
Happy birthday from one fire to anotger,,,,,,,,,,,,,,,,,,,,,,,,,,,,,
The world owes a a debt of gratitude to fires.  Happy birthday,,,,,,,,,,,,,,,,,,,,,,,,,,,,,
"Be sure to put out the fire on your cake, Mary!",,,,,,,,,,,,,,,,,,,,,,,,,,,,,
"Happy Birthday, Mary!",,,,,,,,,,,,,,,,,,,,,,,,,,,,,
"They say cats have 9 lives, but thanks to your hard work as a firefighter, they might have 10!",,,,,,,,,,,,,,,,,,,,,,,,,,,,,
Happy 50th Birthday Mary!,,,,,,,,,,,,,,,,,,,,,,,,,,,,,
Here comes the Mary truck! Happy 50th!,,,,,,,,,,,,,,,,,,,,,,,,,,,,,
"Thanks for all your hard work, Mary!",,,,,,,,,,,,,,,,,,,,,,,,,,,,,
"Mary, they should spell your name Merry. Because you make everyday feel like Christmas!",,,,,,,,,,,,,,,,,,,,,,,,,,,,,
"Thanks for being a hero to us, Mary!",,,,,,,,,,,,,,,,,,,,,,,,,,,,,
"Mary, you are a 50 alarm fire!",,,,,,,,,,,,,,,,,,,,,,,,,,,,,
"Happy big 5-0, Mary!",,,,,,,,,,,,,,,,,,,,,,,,,,,,,
"Mary, the only fire you can't put out is you! Ow ow!",,,,,,,,,,,,,,,,,,,,,,,,,,,,,
"Here's to another 50 great years, Mary!",,,,,,,,,,,,,,,,,,,,,,,,,,,,,
Happy Half Century!,,,,,,,,,,,,,,,,,,,,,,,,,,,,,
50 glorious years - a candle each for the number of fires you have fought!,,,,,,,,,,,,,,,,,,,,,,,,,,,,,
Don't mistake the candles to be a fire to be put out! Happy Birthday!,,,,,,,,,,,,,,,,,,,,,,,,,,,,,
How about 50 hoses for your cake rather than 50 candles? Happy Birthday!,,,,,,,,,,,,,,,,,,,,,,,,,,,,,
This is one type of fire you need not fight! Happy 50th!,,,,,,,,,,,,,,,,,,,,,,,,,,,,,
"Quick! The cake is on fire! Oh wait, no - it's your 50th Birthday!",,,,,,,,,,,,,,,,,,,,,,,,,,,,,
A fiery hot Happy 50th to Mary!,,,,,,,,,,,,,,,,,,,,,,,,,,,,,
CUNT CUNT BITCH NIGGER CUNT SHIT DICK FUCK.,,,,,,,,,,,,,,,,,,,,,,,,,,,,,
"There is a fire in the woods, icing on the ground and noahs flood holds the wrath able to extinguish this fire. There is another wood, but down south where iron meets iron, resting atop a cotton bed. Beneath this cotton bed lies a beast, pulsating in tubular protrusions. Crimson red and purple hues adorn this beast as it majestically twitches at the sight of Mary.",,,,,,,,,,,,,,,,,,,,,,,,,,,,,
"Mary needs tuh suk muh dik an' make me a cake fo' muh burfday, ya hurr?",,,,,,,,,,,,,,,,,,,,,,,,,,,,,
"DONT BLOW OUT THE CANDLES. 

BLOW ME INSTEAD. MARY.",,,,,,,,,,,,,,,,,,,,,,,,,,,,,
Adding one more candle does not make you older.....it make your life brighter ......Happy Birthday !!!!!,,,,,,,,,,,,,,,,,,,,,,,,,,,,,
"65
32
120
6532",,,,,,,,,,,,,,,,,,,,,,,,,,,,,
1565236849654sfz6vsdfbsdaeafd865165165,,,,,,,,,,,,,,,,,,,,,,,,,,,,,
wewrgjtkjtsosk jggkbmb 8 8s9f  ks skhttid n thsjaidgi g idit sn al lkdmf m  hjtasotm s ltk na,,,,,,,,,,,,,,,,,,,,,,,,,,,,,
q4ui234ou24309p0[' ,,,,,,,,,,,,,,,,,,,,2014-05-23 06:27:03.678000,,,,,,,,,
"slts s651a65sdg 1
 61 
651+65
1 asetq4w5q35ywet 1
  6+
5 310
6++.
 + 498+8/+49 86+4 6+5 19+9 84 9 86 1 + 49*784 98 65 163
19 86 +4 +85196516549+49*865",,,,,,,,,,,,,,,,,,,,,,,,,,,,,
f,,,,,,,,,,,,,,,,,,,,,,,,,,,,,
"qrtw654oi;j;okmlmlkout2345rftyhgjhjnkm.,",,,,,,,,,,,,,,,,,,,,,,,,,,,,,
26+84896519+865123986796516512,,,,,,,,,,,,,,,,,,,,,,,,,,,,,
uyguiuuiy87667gyubkhkllkgrgwezsrxdcg,,,,,,,,,,,,,,,,,,,,,,,,,,,,,
"klmaoaisgna kauw3r q8o49 i0qp4 q4   +  */+ *9 + 8 465 2 
9 68+ +9 4-+*/-+ 8 +98",,,,,,,,,,,,,,,,,,,,,,,,,,,,,
ff,,,,,,,,,,,,,,,,,,,,,,,,,,,,,
2134rygjhnmjhgfdxseawretyul,,,,,,,,,,,,,,,,,,,,,,,,,,,,,
"sirutwiq4[0pyi5[w4ep[
fl g ;l   =- = ][  ][
; ' ;[] \ [ '\ [
l wp49qu498wior kl 
'a'\
\wr'q\ ]
w '\q44w
\ s  q6
4 36r+fx9
6352+6
2",,,,,,,,,,,,,,,,,,,,,,,,,,,,,
serakmrtkrmo4iqo4i5o24hrlgmlm,,,,,,,,,,,,,,,,,,,, ljd pai ,oldkngasjdl gnaek.t hqpwiu4oirljg,sl f,0,0,0,19,1659,litw_1,2014-05-23 06:25:49.440000
649+651/**++,,,,,,,,,,,,,,,,,,,,,,,,,,,,,
kjnsrisjlytlktgm? aleniugng! lskskboiaeoidgjv54 5???? jeiouaolk,,,,,,,,,,,,,,,,,,,,,,,,,,,,,
2356475yhrtsgefds,,,,,,,,,,,,,,,,,,,,,,,,,,,,,
2327y3wrgfaa,,,,,,,,,,,,,,,,,,,,,,,,,,,,,
"ataetlkmfojapg,pw1892io jo1 j1r okt m  klmthtoaimtam  otmalkmt oio3j  lkm o imlqk .,af   45 156 1 6516216  6511 32323  16 6 5163263",,,,,,,,,,,,,,,,,,,,,,,,,,,,,
"+6
3165
3
2

6516s5r1gs6ethrgwe6rtikuyjhtdgrsfd",,,,,,,,,,,,,,,,,,,,,,,,,,,,,
*98984984+/*7+,,,,,,,,,,,,,,,,,,,,,,,,,,,,,
"5rythjklo8o256
31211321
22
3",,,,,,,,,,,,,,,,,,,,,,,,,,,,,
wrt4345,,,,,,,,,,,,,,,,,,,,,,,,,,,,,
ek5jrsalkm oiwrug w87wt w09tw46899i e9oi jk  ilkuh yi tde rt34 3w 3w re sw34 35e47 6576 y 8iu j io p[\4754216 532,,,,,,,,,,,,,,,,,,,,,,,,,,,,,
45753355hqhhragasgfsthw,,,,,,,,,,,,,,,,,,,,,,,,,,,,,
677698ihijkiug5e3qaswedtrfyuAESRDTFVYBUIL7T768UOJIKO,,,,,,,,,,,,,,,,,,,,,,,,,,,,,
wtiuwejtmlakmef kt ht ush thjlst oijq938493i41i kiut thsisi a,,,,,,,,,,,,,,,,,,,,2014-05-23 06:26:51.402000,,,,,,,,,
"#$%^%&%&*^%$%&$^&^*&uolkma35d2g106
30
320
+rtrsgdfdvcfg980-[]=",,,,,,,,,,,,,,,,,,,,,,,,,,,,,
3453452,,,,,,,,,,,,,,,,,,,,,,,,,,,,,
"aksjena;oewtiji[op[oq[wpoetk;a';d/ :Klzk.jr, baj hgq  iu ok a;  pa's la[0r9a p98ouij;huiuhkjlbknkbhvcbn,m",,,,,,,,,,,,,,,,,,,,,,,,,,,,,
you know what day it is? is you 50th day on this earth!,,,,,,,,,,,,,,,,,,,,,,,,,,,,,
and you dont die in a fire,,,,,,,,,,,,,,,,,,,,,,,,,,,,,
happy b day mary!,,,,,,,,,,,,,,,,,,,,,,,,,,,,,
"i miss you realy bad, lol jkl",,,,,,,,,,,,,,,,,,,,,,,,,,,,,
i love you mary,,,,,,,,,,,,,,,,,,,,,,,,,,,,,
ya go you@,,,,,,,,,,,,,,,,,,,,,,,,,,,,,
you still can work!,,,,,,,,,,,,,,,,,,,,,,,,,,,,,
you are 50!,,,,,,,,,,,,,,,,,,,,,,,,,,,,,
i bruned my face off come help me,,,,,,,,,,,,,,,,,,,,,,,,,,,,,
50 is not that old wait till your 100!,,,,,,,,,,,,,,,,,,,,,,,,,,,,,
you are realy OLD!,,,,,,,,,,,,,,,,,,,,,,,,,,,,,
remember to not die in a fire!,,,,,,,,,,,,,,,,,,,,,,,,,,,,,
mahahhahahaha now your 50 and out of work!,,,,,,,,,,,,,,,,,,,,,,,,,,,,,
Have a fiery blast on your golden jubilee!,,,,,,,,,,,,,,,,,,,,,,,,,,,,,
"Half a century gone, another half to come... Happy birthday at the mid point of this amazing journey, which is life!",,,,,,,,,,,,,,,,,,,,,,,,,,,,,
Don't start a fire with all 50 of those candles!,,,,,,,,,,,,,,,,,,,,,,,,,,,,,
What's the difference between a fire fighter and a pole dancer? One starts fires and the other puts them out!,,,,,,,,,,,,,,,,,,,,,,,,,,,,,
Hope you enjoy the hose later on tonight!,,,,,,,,,,,,,,,,,,,,,,,,,,,,,
50 candles? Hope they don't go up in flames,,,,,,,,,,,,,,,,,,,,,,,,,,,,,
Don't forget to put out your candles on your 50th bday,,,,,,,,,,,,,,,,,,,,,,,,,,,,,
Have a fierce and and fiery 50th birthday celebration,,,,,,,,,,,,,,,,,,,,,,,,,,,,,
Have a hot fiery 50th birthday,,,,,,,,,,,,,,,,,,,,,,,,,,,,,
Put out those candles on your 50th birthday,,,,,,,,,,,,,,,,,,,,,,,,,,,,,
May those candles go up in flames,,,,,,,,,,,,,,,,,,,,,,,,,,,,,
Wishing you a flaming 50,,,,,,,,,,,,,,,,,,,,,,,,,,,,,
Hope your birthday goes up in flames,,,,,,,,,,,,,,,,,,,,,,,,,,,,,
Happy 50th birthday may it be flaming hot,,,,,,,,,,,,,,,,,,,,,,,,,,,,,
May your birthday be as hot as you are,,,,,,,,,,,,,,,,,,,,,,,,,,,,,
Have a hot hot hot 50th birthday,,,,,,,,,,,,,,,,,,,,,,,,,,,,,
I hope your 50th birthday is as hot as you get,,,,,,,,,,,,,,,,,,,,,,,,,,,,,
"Happy Birthday to our favorite Firefighter, Mary!",,,,,,,,,,,,,,,,,,,,,,,,,,,,,
Fighting the fire up an over the hill.,,,,,,,,,,,,,,,,,,,,,,,,,,,,,
"She didn't start the fire, It was always burning til Mary came and fought it! Happy 50th Mary!",,,,,,,,,,,,,,,,,,,,,,,,,,,,,
Fire is no match for Mary! She is Burning brighter every year!,,,,,,,,,,,,,,,,,,,,,,,,,,,,,
"Mary, you are actually an autistic idiot. Please never speak to me again",,,,,,,,,,,,,,,,,,,,,,,,,,,,,
"Mary! I haven't seen you in 20 years you old timer. You owe me at least 30 bucks from that bet I won, remember?",,,,,,,,,,,,,,,,,,,,,,,,,,,,,
Your fire will burn brighter than ever on this birthday!,,,,,,,,,,,,,,,,,,,,,,,,,,,,,
"You know, most people only live to be 80 or so, but I think you can reach at least 81!",,,,,,,,,,,,,,,,,,,,,,,,,,,,,
I really hope that my messages are of the highest quality and someone doesn't personally look them over.,,,,,,,,,,,,,,,,,,,,,,,,,,,,,
I am the greatest! shazbot!,,,,,,,,,,,,,,,,,,,,,,,,,,,,,
Happy birthday you old geezer you!,,,,,,,,,,,,,,,,,,,,,,,,,,,,,
"You didn't even remember my birthday last year, Mary. Luckily, I remembered yours!",,,,,,,,,,,,,,,,,,,,,,,,,,,,,
YOLO this is my message,,,,,,,,,,,,,,,,,,,,,,,,,,,,,
"Keep on burning, Mary!",,,,,,,,,,,,,,,,,,,,,,,,,,,,,
"Dear Mary,

You sure are getting old please no copy pasterino frapuccino",,,,,,,,,,,,,,,,,,,,,,,,,,,,,
VGS VGS VGS I sure love to spam out messages!,,,,,,,,,,,,,,,,,,,,,,,,,,,,,
Happy birthday to you Mary!,,,,,,,,,,,,,,,,,,,,,,,,,,,,,
I hope you have a great birthday this year,,,,,,,,,,,,,,,,,,,,,,,,,,,,,
"Come on Mary, light my fire",,,,,,,,,,,,,,,,,,,,,,,,,,,,,
Here's to 50 year! And here's to another 50!,,,,,,,,,,,,,,,,,,,,,,,,,,,,,
Mary! You're the bomb! Keep burning bright you loveable sod!,,,,,,,,,,,,,,,,,,,,,,,,,,,,,
Putting out flames like there's no tomorrow. Happy birthday!,,,,,,,,,,,,,,,,,,,,,,,,,,,,,
happy birthday!,,,,,,,,,,,,,,,,,,,,,,,,,,,,,
What a great milestone! Happy birthday!,,,,,,,,,,,,,,,,,,,,,,,,,,,,,
"Another year, another fire to put out. Happy birthday!",,,,,,,,,,,,,,,,,,,,,,,,,,,,,
You must like birthdays because you get to put out candle flames.,,,,,,,,,,,,,,,,,,,,,,,,,,,,,
Mary is the oldest firefighting broad we know.  Happy Birthday Mary!,,,,,,,,,,,,,,,,,,,,,,,,,,,,,
"Happy 39th, Mary!",,,,,,,,,,,,,,,,,,,,,,,,,,,,,
"Have a fire-filled 50th birthday, Mary!",,,,,,,,,,,,,,,,,,,,,,,,,,,,,
"Happy 50th Birthday to you, Mary!",,,,,,,,,,,,,,,,,,,,,,,,,,,,,
"To a fantastic firefighter on her 50th birthday,
Mary is lucky to have made it this far!",,,,,,,,,,,,,,,,,,,,,,,,,,,,,
A Firefighter named Mary is a half century today.,,,,,,,,,,,,,,,,,,,,,,,,,,,,,
"Happy birthday, to a bright and wonderful woman.",,,,,,,,,,,,,,,,,,,,,,,,,,,,,
"Without you, the world would be aflame.",,,,,,,,,,,,,,,,,,,,,,,,,,,,,
"For 50 years, the world has had a brightness in you.",,,,,,,,,,,,,,,,,,,,,,,,,,,,,
Today is the first day of the rest of your life!,,,,,,,,,,,,,,,,,,,,,,,,,,,,,
Keep the flame going!,,,,,,,,,,,,,,,,,,,,,,,,,,,,,
Never give up!  Never stop improving!,,,,,,,,,,,,,,,,,,,,,,,,,,,,,
Happy birthday!,,,,,,,,,,,,,,,,,,,,,,,,,,,,,
Keep the fire burning in your heart!,,,,,,,,,,,,,,,,,,,,,,,,,,,,,
You're a flame that can't be put out!,,,,,,,,,,,,,,,,,,,,,,,,,,,,,
Rush to put out this candle! Happy 50th birthday.,,,,,,,,,,,,,,,,,,,,,,,,,,,,,
You can put out the fire on this candle!  Happy Birthday!!,,,,,,,,,,,,,,,,,,,,,,,,,,,,,
50 is the new 30!,,,,,,,,,,,,,,,,,,,,,,,,,,,,,
happy birthday!,,,,,,,,,,,,,,,,,,,,,,,,,,,,,
I'm glad that we were coworkers for so long,,,,,,,,,,,,,,,,,,,,,,,,,,,,,
You are a winner and a champion .happy birthday,,,,,,,,,,,,,,,,,,,,,,,,,,,,,
Don't put out the candles on the cake!,,,,,,,,,,,,,,,,,,,,,,,,,,,,,
Have a fantastic birthday!,,,,,,,,,,,,,,,,,,,,,,,,,,,,,
"You're the best Mary, thanks for being there for me! Happy Birthday!",,,,,,,,,,,,,,,,,,,,,,,,,,,,,
"You're such a bright spark in our lives, happy birthday!",,,,,,,,,,,,,,,,,,,,,,,,,,,,,
Here's to another 50 years!,,,,,,,,,,,,,,,,,,,,,,,,,,,,,
Set the world ablaze these next 50 years!,,,,,,,,,,,,,,,,,,,,,,,,,,,,,
You're the light in all of our fires,,,,,,,,,,,,,,,,,,,,,,,,,,,,,
Hope you have a fantastic Birthday,,,,,,,,,,,,,,,,,,,,,,,,,,,,,
Three cheers for Mary! Happy Birthday!,,,,,,,,,,,,,,,,,,,,,,,,,,,,,
"Happy Birthday Mary, 50 years strong!",,,,,,,,,,,,,,,,,,,,,,,,,,,,,
"Keep on truckin', Mary! Happy BD!",,,,,,,,,,,,,,,,,,,,,,,,,,,,,
Hope you enjoy your special day!,,,,,,,,,,,,,,,,,,,,,,,,,,,,,
You're the coolest firefighter I know,,,,,,,,,,,,,,,,,,,,,,,,,,,,,
"Super mega happy birthday to you, Mary!",,,,,,,,,,,,,,,,,,,,,,,,,,,,,
"Happy BD, you're the best Mary!",,,,,,,,,,,,,,,,,,,,,,,,,,,,,
happy birthday!,,,,,,,,,,,,,,,,,,,,,,,,,,,,,
You are a winner and a champion .happy birthday,,,,,,,,,,,,,,,,,,,,,,,,,,,,,
I'm glad that we were coworkers for so long,,,,,,,,,,,,,,,,,,,,,,,,,,,,,
May you live on another half a century to save many more lives. Happy birthday!,,,,,,,,,,,,,,,,,,,,,,,,,,,,,
Dowse the fires outside,,,,,,,,,,,,,,,,,,,,,,,,,,,,,
You rise like the phoenix every time you emerge from those fires. Happy 50,,,,,,,,,,,,,,,,,,,,,,,,,,,,,
The advantage of old age is that you get many people to love.,,,,,,,,,,,,,,,,,,,,,,,,,,,,,
"Count the age, not the wrinkles you have. Count the blessings and the wonderful experience not the mistakes you have made.",,,,,,,,,,,,,,,,,,,,,,,,,,,,,
All my love,,,,,,,,,,,,,,,,,,,,,,,,,,,,,
"I’m so glad you were born, because you brighten my life and fill it with joy. Wishing you a day filled with love and cheer. Hoping your day will be as special as you are. Happy Birthday!",,,,,,,,,,,,,,,,,,,,,,,,,,,,,
I wish you all the happiness in the world! Bday,,,,,,,,,,,,,,,,,,,,,,,,,,,,,
"Happy Birthday Mary, wish you the best of the best on this day and always",,,,,,,,,,,,,,,,,,,,,,,,,,,,,
"Happy birthday, Mary.  Will you be needing to borrow our truck to blow off all those candles!",,,,,,,,,,,,,,,,,,,,,,,,,,,,,
Wishing you nothing but the best on you special day!,,,,,,,,,,,,,,,,,,,,,,,,,,,,,
"They said you start living at 50, so go head and start your life, happy Birthday Mary",,,,,,,,,,,,,,,,,,,,,,,,,,,,,
"Happy Birthday, hope your birthday wishes come true!",,,,,,,,,,,,,,,,,,,,,,,,,,,,,
I wish I had fifty ways to say how much you fire me up,,,,,,,,,,,,,,,,,,,,,,,,,,,,,
I wish I were a fire just to be near you,,,,,,,,,,,,,,,,,,,,,,,,,,,,,
You could never put out the fire in your heart.,,,,,,,,,,,,,,,,,,,,,,,,,,,,,
"Mary, you are burning up the years, but you still have many left to burn.",,,,,,,,,,,,,,,,,,,,,,,,,,,,,
There must be 50 ways to fight fire but only one to be a sweetheart like you.,,,,,,,,,,,,,,,,,,,,,,,,,,,,,
Ooooh.  Looks who's turning 50 and is on fire.,,,,,,,,,,,,,,,,,,,,,,,,,,,,,
Ouch!  You're hot.  Happy 50th Birthday!,,,,,,,,,,,,,,,,,,,,,,,,,,,,,
We wish you 50 more wonderful years of hotness.,,,,,,,,,,,,,,,,,,,,,,,,,,,,,
Fire! Fire!  This hot lady is turning 50.,,,,,,,,,,,,,,,,,,,,,,,,,,,,,
"happy 50th,you are now on good side of 50",,,,,,,,,,,,,,,,,,,,,,,,,,,,,
marry 50th day,,,,,,,,,,,,,,,,,,,,,,,,,,,,,
fire 50bday mary,,,,,,,,,,,,,,,,,,,,,,,,,,,,,
golden jubilee to our own mary who is our fefi,,,,,,,,,,,,,,,,,,,,,,,,,,,,,
"it takes lot of x to be female 50 and frefighter,mary 50",,,,,,,,,,,,,,,,,,,,,,,,,,,,,
Let each candle represent a special memory and joy,,,,,,,,,,,,,,,,,,,,,,,,,,,,,
Happy Birthday to a very special friend,,,,,,,,,,,,,,,,,,,,,,,,,,,,,
May your birthday bring you the joy that you have brought to us,,,,,,,,,,,,,,,,,,,,,,,,,,,,,
May all your wishes come true,,,,,,,,,,,,,,,,,,,,,,,,,,,,,
To a very special friend and true hero,,,,,,,,,,,,,,,,,,,,,,,,,,,,,
May you continue to grow and blossom,,,,,,,,,,,,,,,,,,,,,,,,,,,,,
May your day be filled with love and light,,,,,,,,,,,,,,,,,,,,,,,,,,,,,
May the years continue to bring you much joy and luck,,,,,,,,,,,,,,,,,,,,,,,,,,,,,
Hoping that the future will bring you much joy and fulfillment,,,,,,,,,,,,,,,,,,,,,,,,,,,,,
Every year we celebrate the day the fires of the world got dimmer.  Happy Birthday.,,,,,,,,,,,,,,,,,,,,,,,,,,,,,
"With every fire you put out, the fire in our heart burns that much brighter.",,,,,,,,,,,,,,,,,,,,,,,,,,,,,
We've set some candles alight on your cake and wondered if you could extinguish them for us.,,,,,,,,,,,,,,,,,,,,,,,,,,,,,
"Happy Birthday, Mary.",,,,,,,,,,,,,,,,,,,,,,,,,,,,,
Big Bang Birthday!,,,,,,,,,,,,,,,,,,,,,,,,,,,,,
Faith Hope and Love! Happy Happy Birthday!,,,,,,,,,,,,,,,,,,,,,,,,,,,,,
Birthday and Happy is a Happy Birthday!,,,,,,,,,,,,,,,,,,,,,,,,,,,,,
be careful of what you wish for cause you just might get it!,,,,,,,,,,,,,,,,,,,,,,,,,,,,,
"happy birthday mary, here's hoping you have a 3 alarm birthday!",,,,,,,,,,,,,,,,,,,,,,,,,,,,,
"happy birthday mary, lets hope your day wont go up in smoke",,,,,,,,,,,,,,,,,,,,,,,,,,,,,
"happy birthday mary, we wanted to put 50 candles on the cake. but something about fire hazards from too many candles stopped us",,,,,,,,,,,,,,,,,,,,,,,,,,,,,
"happy birthday mary, now its time to put out the candles....without a firehose",,,,,,,,,,,,,,,,,,,,,,,,,,,,,
"Happy birthday, Mary, and may you continue to make cats and catowners happy for many years to come!",,,,,,,,,,,,,,,,,,,,,,,,,,,,,
Keep the flame on!,,,,,,,,,,,,,,,,,,,,,,,,,,,,,
You sure aren't scared of heights for someone who's been around for half a century!,,,,,,,,,,,,,,,,,,,,,,,,,,,,,
Keep the fire burning inside!,,,,,,,,,,,,,,,,,,,,,,,,,,,,,
Half a century of killing fires! Here's to another one keeping the flame inside alive!,,,,,,,,,,,,,,,,,,,,,,,,,,,,,
May the only important fire never die!,,,,,,,,,,,,,,,,,,,,,,,,,,,,,
"Some flames cannot be quenched, on this your birthday you burn brighter than ever",,,,,,,,,,,,,,,,,,,,,,,,,,,,,
"Happy Birthday, watch out for those candles",,,,,,,,,,,,,,,,,,,,,,,,,,,,,
Your fire still burning Strong,,,,,,,,,,,,,,,,,,,,,,,,,,,,,
"A burning beacon of life, may you have a wonderful day on this, your birthday",,,,,,,,,,,,,,,,,,,,,,,,,,,,,
"No matter how many years go by, you shine just as brightly",,,,,,,,,,,,,,,,,,,,,,,,,,,,,
Happy Birthday!,,,,,,,,,,,,,,,,,,,,,,,,,,,,,
After all these years you remain inextinguishable,,,,,,,,,,,,,,,,,,,,,,,,,,,,,
May the flames of your youth never die,,,,,,,,,,,,,,,,,,,,,,,,,,,,,
It's time for a disco inferno!,,,,,,,,,,,,,,,,,,,,,,,,,,,,,
Party like it's your birthday,,,,,,,,,,,,,,,,,,,,,,,,,,,,,
Happy Birthday!,,,,,,,,,,,,,,,,,,,,,,,,,,,,,
Happy birthday Mary!,,,,,,,,,,,,,,,,,,,,,,,,,,,,,
Happy 50th!,,,,,,,,,,,,,,,,,,,,,,,,,,,,,
Have a whale of a time!,,,,,,,,,,,,,,,,,,,,,,,,,,,,,
"Wishing you a wonderful birthday, Mary!",,,,,,,,,,,,,,,,,,,,,,,,,,,,,
"Happy 50th birthday, Mary!",,,,,,,,,,,,,,,,,,,,,,,,,,,,,
Have a good one!,,,,,,,,,,,,,,,,,,,,,,,,,,,,,
50th birthday get,,,,,,,,,,,,,,,,,,,,,,,,,,,,,
Best wishes!,,,,,,,,,,,,,,,,,,,,,,,,,,,,,
We'll have a party like a house on fire!,,,,,,,,,,,,,,,,,,,,,,,,,,,,,
flaming firefighter at fifty,,,,,,,,,,,,,,,,,,,,,,,,,,,,,
yourea hero,,,,,,,,,,,,,,,,,,,,,,,,,,,,,
happy birthday!,,,,,,,,,,,,,,,,,,,,,,,,,,,,,
is that a hose or are you happy to see me?,,,,,,,,,,,,,,,,,,,,,,,,,,,,,
on fire at fifty,,,,,,,,,,,,,,,,,,,,,,,,,,,,,
someone dial 911! hot mama coming through,,,,,,,,,,,,,,,,,,,,,,,,,,,,,
hot mama!,,,,,,,,,,,,,,,,,,,,,,,,,,,,,
it's getting hot in here so take off all your clothes!,,,,,,,,,,,,,,,,,,,,,,,,,,,,,
have to say youre one sight for sore eyes,,,,,,,,,,,,,,,,,,,,,,,,,,,,,
it'sheating up!!,,,,,,,,,,,,,,,,,,,,,,,,,,,,,
thank you for your duty,,,,,,,,,,,,,,,,,,,,,,,,,,,,,
have another geat birthday,,,,,,,,,,,,,,,,,,,,,,,,,,,,,
"for those waning moments when last second decisions should be made, id like to remind you of how great you are",,,,,,,,,,,,,,,,,,,,,,,,,,,,,
"you have risen like a phoenix from the flames, happy birthday",,,,,,,,,,,,,,,,,,,,,,,,,,,,,
"So many years of fighting fire, maybe it's time for you to retire",,,,,,,,,,,,,,,,,,,,,,,,,,,,,
"I was gonna get you a fire extinguisher for all the candles on your cake, but then I realized that you have a fire truck.  Happy birthday!",,,,,,,,,,,,,,,,,,,,,,,,,,,,,
"After all these years, your passion for saving lives is still burning strong.  Happy birthday!",,,,,,,,,,,,,,,,,,,,,,,,,,,,,
Is that menopause?  Or the burning room upstairs?  Happy birthday!,,,,,,,,,,,,,,,,,,,,,,,,,,,,,
Happy birthday to a true hero!,,,,,,,,,,,,,,,,,,,,,,,,,,,,,
Baby you're burning hot! Oh wait....that's just menopause.,,,,,,,,,,,,,,,,,,,,,,,,,,,,,
Hope you have a smokin' hot birthday!,,,,,,,,,,,,,,,,,,,,,,,,,,,,,
Halfway to the century mark!,,,,,,,,,,,,,,,,,,,,,,,,,,,,,
"Keep those homefires from burning, except on your birthday cake!",,,,,,,,,,,,,,,,,,,,,,,,,,,,,
There's one time you need to make a wish before putting out a fire -- blowing out your birthday candles!,,,,,,,,,,,,,,,,,,,,,,,,,,,,,
50 is the new 20!,,,,,,,,,,,,,,,,,,,,,,,,,,,,,
I won't be buying you a gift this year. I got you this card instead.,,,,,,,,,,,,,,,,,,,,,,,,,,,,,
"Here's a card to wish you a happy birthday! Enjoy it, it's all I got you.",,,,,,,,,,,,,,,,,,,,,,,,,,,,,
You're almost as old as you are cheap.,,,,,,,,,,,,,,,,,,,,,,,,,,,,,
Happy birthday. One more year to go until you get another card just like this one.,,,,,,,,,,,,,,,,,,,,,,,,,,,,,
Happy birthday. You made it through another year.,,,,,,,,,,,,,,,,,,,,,,,,,,,,,
Is it the fire that keeps you looking so hot?,,,,,,,,,,,,,,,,,,,,,,,,,,,,,
It's not going to be easy to put out this fire. The one from all the candles on your cake! Happy 50th!,,,,,,,,,,,,,,,,,,,,,,,,,,,,,
"Mary, Mary, quite contrary, how does . . . I have nothing clever to put here. Happy birthday anyway!",,,,,,,,,,,,,,,,,,,,,,,,,,,,,
Happy 50th Birthday Mary. Now put out that fire.,,,,,,,,,,,,,,,,,,,,,,,,,,,,,
"Happy 50th Birthday, Mary!",,,,,,,,,,,,,,,,,,,,,,,,,,,,,
This girl is on FIRE!,,,,,,,,,,,,,,,,,,,,,,,,,,,,,
"You're going to need a big bucket of water to put out all of those candles, Mary.",,,,,,,,,,,,,,,,,,,,,,,,,,,,,
"Ironic that the older you get, the more fires get lit in your honor.",,,,,,,,,,,,,,,,,,,,,,,,,,,,,
"50 candles on fire for you, our favorite fire fighter. As long as the candles are well ventilated and not near any flammable liquids or other dangerous fire hazards. The work is never done.",,,,,,,,,,,,,,,,,,,,,,,,,,,,,
Watch for backdrafts. That's a whole lotta fire on that cake.,,,,,,,,,,,,,,,,,,,,,,,,,,,,,
"Our hearts are on fire for you, Mary.",,,,,,,,,,,,,,,,,,,,,,,,,,,,,
Get the hose...there's 50 flames up ahead.,,,,,,,,,,,,,,,,,,,,,,,,,,,,,
You have lit the kindle in our hearts.,,,,,,,,,,,,,,,,,,,,,,,,,,,,,
Even on your 50th birthday....you have to put a bunch of fires out.,,,,,,,,,,,,,,,,,,,,,,,,,,,,,
For the woman who still lights my fire!  Happy Birthday!!,,,,,,,,,,,,,,,,,,,,,,,,,,,,,
Happy Birthday to My Hero,,,,,,,,,,,,,,,,,,,,,,,,,,,,,
Here's one fire you will be happy to extinguish!,,,,,,,,,,,,,,,,,,,,,,,,,,,,,
You might be breaking a few fire codes with all of those candles!,,,,,,,,,,,,,,,,,,,,,,,,,,,,,
Happy birthday to such a hot lady (literally)!,,,,,,,,,,,,,,,,,,,,,,,,,,,,,
Try not to burn your house down with all of those candles!,,,,,,,,,,,,,,,,,,,,,,,,,,,,,
"Sincerest wishes for a happy birthday, and more to come.",,,,,,,,,,,,,,,,,,,,,,,,,,,,,
A smokin' lady deserves a scorcher of a birthday!,,,,,,,,,,,,,,,,,,,,,,,,,,,,,
Still flaming after all these years!,,,,,,,,,,,,,,,,,,,,,,,,,,,,,
"You might need to take your work home to put out the flames from your cake, Happy Birthday!",,,,,,,,,,,,,,,,,,,,,,,,,,,,,
Happy Birthday to one hot lady!,,,,,,,,,,,,,,,,,,,,,,,,,,,,,
"Here's hoping your 50th Birthday is as hot as you still are, Mary!",,,,,,,,,,,,,,,,,,,,,,,,,,,,,
You're 50 and still as fiery as ever!,,,,,,,,,,,,,,,,,,,,,,,,,,,,,
