item,,,,,,,,,,,,,,,,,,,,,,,,,,,,,
50 years and still on fire!,,,,,,,,,,,,,,,,,,,,,,,,,,,,,
Don't let the flame go down.,,,,,,,,,,,,,,,,,,,,,,,,,,,,,
Happy Birthday! --All the kittens you rescued (with drawing of a cat on a tree),,,,,,,,,,,,,,,,,,,,,,,,,,,,,
"Just in case, we got the cake waterproof. Happy Birthday!",,,,,,,,,,,,,,,,,,,,,,,,,,,,,
Congratulations! It seems you safely skipped a mid-life crisis!,,,,,,,,,,,,,,,,,,,,,,,,,,,,,
I bow to your oldness.,,,,,,,,,,,,,,,,,,,,,,,,,,,,,
The advantage of old age is that you get many people to love.,,,,,,,,,,,,,,,,,,,,,,,,,,,,,
"Age is a number, but life is your calculator.",,,,,,,,,,,,,,,,,,,,,,,,,,,,,
Set the world on fire with your dreams and use the flame to light a birthday candle.,,,,,,,,,,,,,,,,,,,,,,,,,,,,,
"Fifty years later, There's (still) Something About Mary.",,,,,,,,,,,,,,,,,,,,,,,,,,,,,
Welcome to the Middle Ages!,,,,,,,,,,,,,,,,,,,,,,,,,,,,,
Wisdom doesn’t necessarily come with age. Sometimes age just shows up all by itself. Happy birthday!,,,,,,,,,,,,,,,,,,,,,,,,,,,,,
"Age is an issue of mind over matter. If you don’t mind, it doesn’t matter.",,,,,,,,,,,,,,,,,,,,,,,,,,,,,
We could certainly slow the aging process down if it had to work its way through Congress. At least you don't have to deal with politicians! Happy Birthday!,,,,,,,,,,,,,,,,,,,,,,,,,,,,,
Aging seems to be the only available way to live a long life. Happy 50th birthday!,,,,,,,,,,,,,,,,,,,,,,,,,,,,,
"I wish you a ""Happy Birthday""! And now I will tell you why it isn't...",,,,,,,,,,,,,,,,,,,,,,,,,,,,,
Your birthday will be just like a bubble,,,,,,,,,,,,,,,,,,,,,,,,,,,,,
7 more years! (Firefighter retirement age at 57),,,,,,,,,,,,,,,,,,,,,,,,,,,,,
I think they forgot to count you when they calculate average firefighters' life expectancies. Happy Birthday!,,,,,,,,,,,,,,,,,,,,,,,,,,,,,
They aren't wrinkles! They are marks of life and wisdom (mostly). Happy Birthday!,,,,,,,,,,,,,,,,,,,,,,,,,,,,,
"Because there is no other like you, Mary me! Oops... wrong day. Happy Birthday, Mary!",,,,,,,,,,,,,,,,,,,,,,,,,,,,,
Congratulations on your 50 year old b-day,,,,,,,,,,,,,,,,,,,,,,,,,,,,,
Stop the fire on that 50 candles,,,,,,,,,,,,,,,,,,,,,,,,,,,,,
50?! Still a beast,,,,,,,,,,,,,,,,,,,,,,,,,,,,,
Keep on fire,,,,,,,,,,,,,,,,,,,,,,,,,,,,,
Still on fire,,,,,,,,,,,,,,,,,,,,,,,,,,,,,
Who knows Mary is 50 now?,,,,,,,,,,,,,,,,,,,,,,,,,,,,,
Enjoy!,,,,,,,,,,,,,,,,,,,,,,,,,,,,,
"Mary, married to a firefighter for 50 years",,,,,,,,,,,,,,,,,,,,,,,,,,,,,
How did 50 years pass so quickly?,,,,,,,,,,,,,,,,,,,,,,,,,,,,,
May this year be flooded with happiness!,,,,,,,,,,,,,,,,,,,,,,,,,,,,,
your great at fighting time!,,,,,,,,,,,,,,,,,,,,,,,,,,,,,
half way there!,,,,,,,,,,,,,,,,,,,,,,,,,,,,,
Happy birthday!,,,,,,,,,,,,,,,,,,,,,,,,,,,,,
Warm (but still within fire code!) wishes on your birthday!,,,,,,,,,,,,,,,,,,,,,,,,,,,,,
Have a blast on your birthday!,,,,,,,,,,,,,,,,,,,,,,,,,,,,,
May the only fires today be your birthday candles!,,,,,,,,,,,,,,,,,,,,,,,,,,,,,
50 and still on fire!  Go Mary!,,,,,,,,,,,,,,,,,,,,,,,,,,,,,
Blowing out 50 candles should be a piece of cake for someone used to fighting fires!,,,,,,,,,,,,,,,,,,,,,,,,,,,,,
Now it's time for US to turn the water on you -- for a birthday shower! Happy 50th birthday.,,,,,,,,,,,,,,,,,,,,,,,,,,,,,
Happy Birthday! Have a wonder-fire birthday!,,,,,,,,,,,,,,,,,,,,,,,,,,,,,
Happy 50th birthday to a real-life hero!,,,,,,,,,,,,,,,,,,,,,,,,,,,,,
Happy Birthday!,,,,,,,,,,,,,,,,,,,,,,,,,,,,,
You're one year older now!,,,,,,,,,,,,,,,,,,,,,,,,,,,,,
Let's have a fire party for Mary!,,,,,,,,,,,,,,,,,,,,,,,,,,,,,
Maybe I'll extinguish your birthday fire with water hose!,,,,,,,,,,,,,,,,,,,,,,,,,,,,,
"Happy birthday, Mary!",,,,,,,,,,,,,,,,,,,,,,,,,,,,,
Don't blow off the candle too soon just because you want to extinguish all the fire out there!,,,,,,,,,,,,,,,,,,,,,,,,,,,,,
Just wanted to let you know that you're loved by everyone surrounded by you. <3,,,,,,,,,,,,,,,,,,,,,,,,,,,,,
May this new year bring you lots of happiness and peace.,,,,,,,,,,,,,,,,,,,,,,,,,,,,,
Beep beep beep! The fire truck is coming! It's Mary's birthday!,,,,,,,,,,,,,,,,,,,,,,,,,,,,,
You bring light to your family and friends! Happy birthday!,,,,,,,,,,,,,,,,,,,,,,,,,,,,,
"Go blow off the ""fire"" on your cake!",,,,,,,,,,,,,,,,,,,,,,,,,,,,,
Wishing you a happy birthday!,,,,,,,,,,,,,,,,,,,,,,,,,,,,,
Happy Birthday! All the best to you,,,,,,,,,,,,,,,,,,,,,,,,,,,,,
Cheers to your golden age. Be strong and happy putting out fire,,,,,,,,,,,,,,,,,,,,,,,,,,,,,
How is being on the other half feel like? Hope you enjoy,,,,,,,,,,,,,,,,,,,,,,,,,,,,,
Good times come with good company. Happy Birthday,,,,,,,,,,,,,,,,,,,,,,,,,,,,,
Enjoy the sun. It comes out to greet you on your special day,,,,,,,,,,,,,,,,,,,,,,,,,,,,,
Age is just a number. Beat that fire :D,,,,,,,,,,,,,,,,,,,,,,,,,,,,,
"I hope you are having a great time for your birthday and many more years to come
Love",,,,,,,,,,,,,,,,,,,,,,,,,,,,,
Let's grab a beer for your big day,,,,,,,,,,,,,,,,,,,,,,,,,,,,,
It's a big 50 for you. Have a blast,,,,,,,,,,,,,,,,,,,,,,,,,,,,,
Happy Birthday! All the best to you,,,,,,,,,,,,,,,,,,,,,,,,,,,,,
Cheers to your golden age. Be strong and happy putting out fire,,,,,,,,,,,,,,,,,,,,,,,,,,,,,
How is being on the other half feel like? Hope you enjoy,,,,,,,,,,,,,,,,,,,,,,,,,,,,,
Good times come with good company. Happy Birthday,,,,,,,,,,,,,,,,,,,,,,,,,,,,,
Enjoy the sun. It comes out to greet you on your special day,,,,,,,,,,,,,,,,,,,,,,,,,,,,,
Age is just a number. Beat that fire :D,,,,,,,,,,,,,,,,,,,,,,,,,,,,,
"I hope you are having a great time for your birthday and many more years to come
Love",,,,,,,,,,,,,,,,,,,,,,,,,,,,,
Let's grab a beer for your big day,,,,,,,,,,,,,,,,,,,,,,,,,,,,,
It's a big 50 for you. Have a blast,,,,,,,,,,,,,,,,,,,,,,,,,,,,,
Some fire or light is great! Especially for the candle on your birthday.,,,,,,,,,,,,,,,,,,,,,,,,,,,,,
Wishing you a happy birthday!,,,,,,,,,,,,,,,,,,,,,,,,,,,,,
"Go blow off the ""fire"" on your cake!",,,,,,,,,,,,,,,,,,,,,,,,,,,,,
You bring light to your family and friends! Happy birthday!,,,,,,,,,,,,,,,,,,,,,,,,,,,,,
Beep beep beep! The fire truck is coming! It's Mary's birthday!,,,,,,,,,,,,,,,,,,,,,,,,,,,,,
May this new year bring you lots of happiness and peace.,,,,,,,,,,,,,,,,,,,,,,,,,,,,,
Just wanted to let you know that you're loved by everyone surrounded by you. <3,,,,,,,,,,,,,,,,,,,,,,,,,,,,,
Don't blow off the candle too soon just because you want to extinguish all the fire out there!,,,,,,,,,,,,,,,,,,,,,,,,,,,,,
"Happy birthday, Mary!",,,,,,,,,,,,,,,,,,,,,,,,,,,,,
Maybe I'll extinguish your birthday fire with water hose!,,,,,,,,,,,,,,,,,,,,,,,,,,,,,
Let's have a fire party for Mary!,,,,,,,,,,,,,,,,,,,,,,,,,,,,,
You're one year older now!,,,,,,,,,,,,,,,,,,,,,,,,,,,,,
Some fire or light is great! Especially for the candle on your birthday.,,,,,,,,,,,,,,,,,,,,,,,,,,,,,
Wishing you a happy birthday!,,,,,,,,,,,,,,,,,,,,,,,,,,,,,
"Go blow off the ""fire"" on your cake!",,,,,,,,,,,,,,,,,,,,,,,,,,,,,
You bring light to your family and friends! Happy birthday!,,,,,,,,,,,,,,,,,,,,,,,,,,,,,
Beep beep beep! The fire truck is coming! It's Mary's birthday!,,,,,,,,,,,,,,,,,,,,,,,,,,,,,
May this new year bring you lots of happiness and peace.,,,,,,,,,,,,,,,,,,,,,,,,,,,,,
Just wanted to let you know that you're loved by everyone surrounded by you. <3,,,,,,,,,,,,,,,,,,,,,,,,,,,,,
Don't blow off the candle too soon just because you want to extinguish all the fire out there!,,,,,,,,,,,,,,,,,,,,,,,,,,,,,
"Happy birthday, Mary!",,,,,,,,,,,,,,,,,,,,,,,,,,,,,
Maybe I'll extinguish your birthday fire with water hose!,,,,,,,,,,,,,,,,,,,,,,,,,,,,,
Let's have a fire party for Mary!,,,,,,,,,,,,,,,,,,,,,,,,,,,,,
You're one year older now!,,,,,,,,,,,,,,,,,,,,,,,,,,,,,
Some fire or light is great! Especially for the candle on your birthday.,,,,,,,,,,,,,,,,,,,,,,,,,,,,,
Wishing you a happy birthday!,,,,,,,,,,,,,,,,,,,,,,,,,,,,,
"Go blow off the ""fire"" on your cake!",,,,,,,,,,,,,,,,,,,,,,,,,,,,,
You bring light to your family and friends! Happy birthday!,,,,,,,,,,,,,,,,,,,,,,,,,,,,,
Beep beep beep! The fire truck is coming! It's Mary's birthday!,,,,,,,,,,,,,,,,,,,,,,,,,,,,,
May this new year bring you lots of happiness and peace.,,,,,,,,,,,,,,,,,,,,,,,,,,,,,
Just wanted to let you know that you're loved by everyone surrounded by you. <3,,,,,,,,,,,,,,,,,,,,,,,,,,,,,
Don't blow off the candle too soon just because you want to extinguish all the fire out there!,,,,,,,,,,,,,,,,,,,,,,,,,,,,,
"Happy birthday, Mary!",,,,,,,,,,,,,,,,,,,,,,,,,,,,,
Maybe I'll extinguish your birthday fire with water hose!,,,,,,,,,,,,,,,,,,,,,,,,,,,,,
Let's have a fire party for Mary!,,,,,,,,,,,,,,,,,,,,,,,,,,,,,
You're one year older now!,,,,,,,,,,,,,,,,,,,,,,,,,,,,,
Some fire or light is great! Especially for the candle on your birthday.,,,,,,,,,,,,,,,,,,,,,,,,,,,,,
Happy Birthday Mary! I hope your birthday is filled with love and joy from family and friends!,,,,,,,,,,,,,,,,,,,,,,,,,,,,,
Happy birthday Mary! Keep the fire burning,,,,,,,,,,,,,,,,,,,,,,,,,,,,,
"50 and still on fire!
Happy Birthday, Mary!",,,,,,,,,,,,,,,,,,,,,,,,,,,,,
Happy Birthday!,,,,,,,,,,,,,,,,,,,,,,,,,,,,,
"Don't worry, this flame is just the candles on your birthday cake!  Happy Birthday, Mary!",,,,,,,,,,,,,,,,,,,,,,,,,,,,,
"Don't worry, this flame is just the candles on your birthday cake!  Happy Birthday, Mary!",,,,,,,,,,,,,,,,,,,,,,,,,,,,,
"You're so cool, the fire has no chance!
Happy Birthday, Mary!",,,,,,,,,,,,,,,,,,,,,,,,,,,,,
Happy Birthday!,,,,,,,,,,,,,,,,,,,,,,,,,,,,,
You are the bravest person I know. Happy Birthday.,,,,,,,,,,,,,,,,,,,,,,,,,,,,,
I have always wanted to be a firefighter when turning 50. Happy Birthday!,,,,,,,,,,,,,,,,,,,,,,,,,,,,,
"I would normally wish you a big firework, but yes... the dangers of turning 50!",,,,,,,,,,,,,,,,,,,,,,,,,,,,,
Happy Birthday and lots of fireworks!,,,,,,,,,,,,,,,,,,,,,,,,,,,,,
Hell yeah. Let's have some fire!,,,,,,,,,,,,,,,,,,,,,,,,,,,,,
Mary on fire! Happy Birthday :),,,,,,,,,,,,,,,,,,,,,,,,,,,,,
Hope you will always be on fire!,,,,,,,,,,,,,,,,,,,,,,,,,,,,,
Half a century and you are still on fire!,,,,,,,,,,,,,,,,,,,,,,,,,,,,,
Happy 50s fireworks!,,,,,,,,,,,,,,,,,,,,,,,,,,,,,
Hope you are having as much fire in the next 50 years!,,,,,,,,,,,,,,,,,,,,,,,,,,,,,
Let the water be plentiful,,,,,,,,,,,,,,,,,,,,,,,,,,,,,
You light my fire,,,,,,,,,,,,,,,,,,,,,,,,,,,,,
Over the hill!,,,,,,,,,,,,,,,,,,,,,,,,,,,,,
Much birthday love.,,,,,,,,,,,,,,,,,,,,,,,,,,,,,
Wish you a wonderful second half century,,,,,,,,,,,,,,,,,,,,,,,,,,,,,
Enjoy time with your cats!!,,,,,,,,,,,,,,,,,,,,,,,,,,,,,
Wish you safety,,,,,,,,,,,,,,,,,,,,,,,,,,,,,
Happy Birthday!! :),,,,,,,,,,,,,,,,,,,,,,,,,,,,,
Thanks for every lives you safe,,,,,,,,,,,,,,,,,,,,,,,,,,,,,
Wish you a long happy life,,,,,,,,,,,,,,,,,,,,,,,,,,,,,
"Dear Mary,

Happy half-the-century Birthday! We thank you for all your hard work that you have done for our company. We wish you happiness, joy, and success. May the fire in your heart can never be put off. Stay young and lively, as you have always been.

Best of luck,
M",,,,,,,,,,,,,,,,,,,,,,,,,,,,,
Happy 50th!,,,,,,,,,,,,,,,,,,,,,,,,,,,,,
Great work.,,,,,,,,,,,,,,,,,,,,,,,,,,,,,
Is it safe to light 50 candles for your birthday?  Let's find out!,,,,,,,,,,,,,,,,,,,,,,,,,,,,,
Happy birthday to the most kick-ass firefighter!,,,,,,,,,,,,,,,,,,,,,,,,,,,,,
50 years old and still fighting fires!,,,,,,,,,,,,,,,,,,,,,,,,,,,,,
Wish you a happy healthy freshie life!,,,,,,,,,,,,,,,,,,,,,,,,,,,,,
Thanks for everyone you have helped,,,,,,,,,,,,,,,,,,,,,,,,,,,,,
"Today is the day to celebrate
With friends and family
With lots of cake and food
Happy 50!",,,,,,,,,,,,,,,,,,,,,,,,,,,,,
"Today is a special day,
A special day for someone special,
Happy Birthday!",,,,,,,,,,,,,,,,,,,,,,,,,,,,,
Enjoy your wonderful time with your grandkids!,,,,,,,,,,,,,,,,,,,,,,,,,,,,,
"Happy Birthday, Mary!!",,,,,,,,,,,,,,,,,,,,,,,,,,,,,
Hope you enjoy some nice & cool time off,,,,,,,,,,,,,,,,,,,,,,,,,,,,,
Keep firing those fires,,,,,,,,,,,,,,,,,,,,,,,,,,,,,
Need a light?,,,,,,,,,,,,,,,,,,,,,,,,,,,,,
Let your hoses be long,,,,,,,,,,,,,,,,,,,,,,,,,,,,,
Help my cat is stuck on that tree,,,,,,,,,,,,,,,,,,,,,,,,,,,,,
Another year another life saved,,,,,,,,,,,,,,,,,,,,,,,,,,,,,
Keep putting those fires out!,,,,,,,,,,,,,,,,,,,,,,,,,,,,,
Age never doused your fire,,,,,,,,,,,,,,,,,,,,,,,,,,,,,
Happy birthday!,,,,,,,,,,,,,,,,,,,,,,,,,,,,,
Let's get fired up for your birthday!,,,,,,,,,,,,,,,,,,,,,,,,,,,,,
Congratulations on extinguishing every fire except aging!,,,,,,,,,,,,,,,,,,,,,,,,,,,,,
Here's wishing you a very happy birthday: may you have many more glowing trips around the sun,,,,,,,,,,,,,,,,,,,,,,,,,,,,,
Happy birthday! May the fire of your heart burn for a hundred more years,,,,,,,,,,,,,,,,,,,,,,,,,,,,,
Special birthday wishes!,,,,,,,,,,,,,,,,,,,,,,,,,,,,,
You're one person I can always count on in case of a fire. Happy Birthday!,,,,,,,,,,,,,,,,,,,,,,,,,,,,,
Happy Birthday!,,,,,,,,,,,,,,,,,,,,,,,,,,,,,
That's one year for each rung on the ladder! Happy Birthday.,,,,,,,,,,,,,,,,,,,,,,,,,,,,,
Have a great Birthday!,,,,,,,,,,,,,,,,,,,,,,,,,,,,,
We are glad to have you as our firefighter. Happy Birthday!,,,,,,,,,,,,,,,,,,,,,,,,,,,,,
Another year of fire-safe neighborhood. Happy Birthday Mary!,,,,,,,,,,,,,,,,,,,,,,,,,,,,,
It's another great year ahead of you!,,,,,,,,,,,,,,,,,,,,,,,,,,,,,
Nobody knows how to put down fire like you do. Happy Birthdays!,,,,,,,,,,,,,,,,,,,,,,,,,,,,,
"Happy Birthday, Mary!",,,,,,,,,,,,,,,,,,,,,,,,,,,,,
"Age can be counted backward starting at 30. Wow, you are so young!",,,,,,,,,,,,,,,,,,,,,,,,,,,,,
"Another year older, another year wiser!",,,,,,,,,,,,,,,,,,,,,,,,,,,,,
Fire fighters unite!,,,,,,,,,,,,,,,,,,,,,,,,,,,,,
Hi mom,,,,,,,,,,,,,,,,,,,,,,,,,,,,,
Happy fireday!,,,,,,,,,,,,,,,,,,,,,,,,,,,,,
Thank you for being such a good friend and an effective firefighter. You rock my world!,,,,,,,,,,,,,,,,,,,,,,,,,,,,,
We will need a fire hydrant to put out the candles on your cake!,,,,,,,,,,,,,,,,,,,,,,,,,,,,,
50 years and 100s of fires,,,,,,,,,,,,,,,,,,,,,,,,,,,,,
You're hot stuff for a 50 year old!,,,,,,,,,,,,,,,,,,,,,,,,,,,,,
Happy Birthday Mary!,,,,,,,,,,,,,,,,,,,,,,,,,,,,,
"A happy birthday

Born two score and ten ago

Great wishes today",,,,,,,,,,,,,,,,,,,,,,,,,,,,,
"Ding Ding Ding!
Is that a fire bell?
No, it's a birthday bell!",,,,,,,,,,,,,,,,,,,,,,,,,,,,,
We are all very happy you were born,,,,,,,,,,,,,,,,,,,,,,,,,,,,,
Cake!,,,,,,,,,,,,,,,,,,,,,,,,,,,,,
The Big 5-0!,,,,,,,,,,,,,,,,,,,,,,,,,,,,,
Happy fireday!,,,,,,,,,,,,,,,,,,,,,,,,,,,,,
You are on fire!,,,,,,,,,,,,,,,,,,,,,,,,,,,,,
Happy Birthday!,,,,,,,,,,,,,,,,,,,,,,,,,,,,,
Time to burn the house down...,,,,,,,,,,,,,,,,,,,,,,,,,,,,,
Guess who is 50 now?!,,,,,,,,,,,,,,,,,,,,,,,,,,,,,
Another year for a great firefighter...,,,,,,,,,,,,,,,,,,,,,,,,,,,,,
another idea,,,,,,,,,,,,,,,,,,,,,,,,,,,,,
Happy birthday,,,,,,,,,,,,,,,,,,,,,,,,,,,,,
hi,,,,,,,,,,,,,,,,,,,,,,,,,,,,,
"Mary, have a wonderful 50th birthday!",,,,,,,,,,,,,,,,,,,,,,,,,,,,,
Happy 50th birthday!,,,,,,,,,,,,,,,,,,,,,,,,,,,,,
50 candles! Your fire-fighting skills will come in handy to blow all those out!,,,,,,,,,,,,,,,,,,,,,,,,,,,,,
Have a fantastic fire-tastic 50th birthday!,,,,,,,,,,,,,,,,,,,,,,,,,,,,,
You're on fire! Happy 50th birthday!,,,,,,,,,,,,,,,,,,,,,,,,,,,,,
"50 years, 50 candles! Hope those fire-fighting skills aren't needed!",,,,,,,,,,,,,,,,,,,,,,,,,,,,,
Have a fire-tastic birthday!,,,,,,,,,,,,,,,,,,,,,,,,,,,,,
Happy birthday!,,,,,,,,,,,,,,,,,,,,,,,,,,,,,
"Let it burn, burn, burn. Have a burning hot birthday!",,,,,,,,,,,,,,,,,,,,,,,,,,,,,
You are a fighter! Keep up the hard work birthday girl!,,,,,,,,,,,,,,,,,,,,,,,,,,,,,
Happy 50 years!!,,,,,,,,,,,,,,,,,,,,,,,,,,,,,
You extinguish fires and light up lives. May you have a wonderful birthday,,,,,,,,,,,,,,,,,,,,,,,,,,,,,
To the hero at home and in the community - happy birthday!,,,,,,,,,,,,,,,,,,,,,,,,,,,,,
Do you know one of the best thing that happened 50 years ago?,,,,,,,,,,,,,,,,,,,,,,,,,,,,,
"One more...one more....Another year..

Have a great birthday!",,,,,,,,,,,,,,,,,,,,,,,,,,,,,
It's your birthday.......Happy Birthday Mary!!,,,,,,,,,,,,,,,,,,,,,,,,,,,,,
"Baby, baby light my fire!",,,,,,,,,,,,,,,,,,,,,,,,,,,,,
50 candles for you to put down!,,,,,,,,,,,,,,,,,,,,,,,,,,,,,
May the second 50 be as good as the first one!,,,,,,,,,,,,,,,,,,,,,,,,,,,,,
your age won't douse your flame!,,,,,,,,,,,,,,,,,,,,,,,,,,,,,
"so birthday
much fire
such mary",,,,,,,,,,,,,,,,,,,,,,,,,,,,,
a five alarm birthday cake for your five-oh birthday!,,,,,,,,,,,,,,,,,,,,,,,,,,,,,
"mary mary firefighter
had a cake but had no lighter
candles couldn't be alight
she'll keep going without a fight!",,,,,,,,,,,,,,,,,,,,,,,,,,,,,
you're only as young as you feel,,,,,,,,,,,,,,,,,,,,,,,,,,,,,
best wishes on the big five-oh,,,,,,,,,,,,,,,,,,,,,,,,,,,,,
happy birthday you old flame,,,,,,,,,,,,,,,,,,,,,,,,,,,,,
happy 50th birthday to mary,,,,,,,,,,,,,,,,,,,,,,,,,,,,,
happy 50th!,,,,,,,,,,,,,,,,,,,,,,,,,,,,,
i wish this bloody thing would submit when i hit enter and not bloody wait for me to click the button like it's 1999 or something.,,,,,,,,,,,,,,,,,,,,,,,,,,,,,
also i swear 4 mins is too long,,,,,,,,,,,,,,,,,,,,,,,,,,,,,
best wishes for blwongng out candles,,,,,,,,,,,,,,,,,,,,,,,,,,,,,
"to mary
best wishes
from all of us at the firehouse",,,,,,,,,,,,,,,,,,,,,,,,,,,,,
happy birthday,,,,,,,,,,,,,,,,,,,,,,,,,,,,,
happy 25th!,,,,,,,,,,,,,,,,,,,,,,,,,,,,,
happy birthday mary,,,,,,,,,,,,,,,,,,,,,,,,,,,,,
and here's to 50 more,,,,,,,,,,,,,,,,,,,,,,,,,,,,,
you're not over the hill yet,,,,,,,,,,,,,,,,,,,,,,,,,,,,,
happyhappyhappyhappyhappyhappyx50,,,,,,,,,,,,,,,,,,,,,,,,,,,,,
firey birthday wishes,,,,,,,,,,,,,,,,,,,,,,,,,,,,,
Turning 50? Fahrenheit or Centigrade?,,,,,,,,,,,,,,,,,,,,,,,,,,,,,
"Happy 50th, Mary!",,,,,,,,,,,,,,,,,,,,,,,,,,,,,
Turning 50 is just a matter of degree.,,,,,,,,,,,,,,,,,,,,,,,,,,,,,
Happy Birthday to the toughest gal we know!,,,,,,,,,,,,,,,,,,,,,,,,,,,,,
Things heating up at 50!,,,,,,,,,,,,,,,,,,,,,,,,,,,,,
You're on fire!,,,,,,,,,,,,,,,,,,,,,,,,,,,,,
May the ducks of your life quack ever harmoniously.,,,,,,,,,,,,,,,,,,,,,,,,,,,,,
A lot more than 16 candles...,,,,,,,,,,,,,,,,,,,,,,,,,,,,,
If there's smoke...,,,,,,,,,,,,,,,,,,,,,,,,,,,,,
And here's to 50 more!,,,,,,,,,,,,,,,,,,,,,,,,,,,,,
"Mary, Mary, incendiary, how do your candles glow?",,,,,,,,,,,,,,,,,,,,,,,,,,,,,
"Happy birthday, Mary!",,,,,,,,,,,,,,,,,,,,,,,,,,,,,
Call the fire department!,,,,,,,,,,,,,,,,,,,,,,,,,,,,,
Happy birthday!,,,,,,,,,,,,,,,,,,,,,,,,,,,,,
Here's to 50 more years of putting out flames!,,,,,,,,,,,,,,,,,,,,,,,,,,,,,
50 and unstoppable!,,,,,,,,,,,,,,,,,,,,,,,,,,,,,
Here's to 50 more!,,,,,,,,,,,,,,,,,,,,,,,,,,,,,
50 years young!,,,,,,,,,,,,,,,,,,,,,,,,,,,,,
"Happy Birthday, to my hero!",,,,,,,,,,,,,,,,,,,,,,,,,,,,,
"Keep putting out fires, you rockstar!",,,,,,,,,,,,,,,,,,,,,,,,,,,,,
Best wishes on your birthday!,,,,,,,,,,,,,,,,,,,,,,,,,,,,,
"Happy half century, Mary!",,,,,,,,,,,,,,,,,,,,,,,,,,,,,
"Happy 50, Mary!  Best decade yet!",,,,,,,,,,,,,,,,,,,,,,,,,,,,,
Happy Birthday to my favorite firefighter!,,,,,,,,,,,,,,,,,,,,,,,,,,,,,
"Happy Birthday, Mary!",,,,,,,,,,,,,,,,,,,,,,,,,,,,,
"Happy milestone birthday, Mary!",,,,,,,,,,,,,,,,,,,,,,,,,,,,,
"The party's just begun.  To another happy and healthy 50 years! Happy birthday, Mary!",,,,,,,,,,,,,,,,,,,,,,,,,,,,,
"Have a very happy 50th birthday, Mary!",,,,,,,,,,,,,,,,,,,,,,,,,,,,,
Happy birthday to the hottest lady around!,,,,,,,,,,,,,,,,,,,,,,,,,,,,,
Wishing you the happiest birthdays. You are such an inspiration!,,,,,,,,,,,,,,,,,,,,,,,,,,,,,
Happy 50th the nicest hero around!,,,,,,,,,,,,,,,,,,,,,,,,,,,,,
"Take a break and celebrate -- Happy birthday, Mary!",,,,,,,,,,,,,,,,,,,,,,,,,,,,,
Hope your 50th party is so hot you need all the protective gear you can wear!,,,,,,,,,,,,,,,,,,,,,,,,,,,,,
49 is seven squared.  50's just a number.  Unless it's your birthday.  Then it's special.,,,,,,,,,,,,,,,,,,,,,,,,,,,,,
"Happy Birthday, Mary!",,,,,,,,,,,,,,,,,,,,,,,,,,,,,
How many firefighters does it take to put out Mary's cake?,,,,,,,,,,,,,,,,,,,,,,,,,,,,,
Why use your breath when you can use a giant firehose to put out your candles?,,,,,,,,,,,,,,,,,,,,,,,,,,,,,
I have a burning desire to tell my favorite firefighter Happy Birthday.,,,,,,,,,,,,,,,,,,,,,,,,,,,,,
Call the station house and set up a party,,,,,,,,,,,,,,,,,,,,,,,,,,,,,
"Down at the firehouse, your cake will be used as the pole pillow.",,,,,,,,,,,,,,,,,,,,,,,,,,,,,
No one can hold a candle to a firefighter on their birthday,,,,,,,,,,,,,,,,,,,,,,,,,,,,,
"Well, 50's legal in most states.",,,,,,,,,,,,,,,,,,,,,,,,,,,,,
Dial 911! It's Mary's 50th birthday!,,,,,,,,,,,,,,,,,,,,,,,,,,,,,
"It's a 50-alarm fire! No, wait, that's your cake.",,,,,,,,,,,,,,,,,,,,,,,,,,,,,
How many candles does it take to make a fire alarm go off?,,,,,,,,,,,,,,,,,,,,,,,,,,,,,
To the hottest lady on the block: happy 50th!,,,,,,,,,,,,,,,,,,,,,,,,,,,,,
"Keep stirring those sparks, lady!",,,,,,,,,,,,,,,,,,,,,,,,,,,,,
"We're so stoked for your birthday! 
(Please don't drown us!)",,,,,,,,,,,,,,,,,,,,,,,,,,,,,
Burning ever more brightly!,,,,,,,,,,,,,,,,,,,,,,,,,,,,,
Some fires mellow. Yours never will!,,,,,,,,,,,,,,,,,,,,,,,,,,,,,
You're a bright candle in a dark world.,,,,,,,,,,,,,,,,,,,,,,,,,,,,,
"Happy Birthday, Mary!",,,,,,,,,,,,,,,,,,,,,,,,,,,,,
"Happy birthday, hope it's a quiet one!",,,,,,,,,,,,,,,,,,,,,,,,,,,,,
"Roses are red,
violets are blue.
Mary's turning fifty,
and gets love from her crew.",,,,,,,,,,,,,,,,,,,,,,,,,,,,,
Fiery Fifty - it's nifty,,,,,,,,,,,,,,,,,,,,,,,,,,,,,
"Mary, Mary, quite the contrarian... who would have thought you were 50?",,,,,,,,,,,,,,,,,,,,,,,,,,,,,
Fifty reasons to love firefighters. Reason #1: Mary.,,,,,,,,,,,,,,,,,,,,,,,,,,,,,
"Another birthday, another life saved... just a normal day",,,,,,,,,,,,,,,,,,,,,,,,,,,,,
"Have a wonderful, relaxing birthday. We'll try to remember to turn off the stove.",,,,,,,,,,,,,,,,,,,,,,,,,,,,,
Here's to 50 more years of saving others.,,,,,,,,,,,,,,,,,,,,,,,,,,,,,
You're on fire at 50~!,,,,,,,,,,,,,,,,,,,,,,,,,,,,,
You Deserve a Hot Time on Your Birthday!,,,,,,,,,,,,,,,,,,,,,,,,,,,,,
I burn with birthday wishes for you!,,,,,,,,,,,,,,,,,,,,,,,,,,,,,
Fighting fires is easier than fighting old age - welcome to your 50's!,,,,,,,,,,,,,,,,,,,,,,,,,,,,,
To the Rescue with Birthday Wishes for Mary!,,,,,,,,,,,,,,,,,,,,,,,,,,,,,
Here's Hoping You Have a Five-Alarm Birthday!,,,,,,,,,,,,,,,,,,,,,,,,,,,,,
"What's harder - a five alarm fire, or turning 50?",,,,,,,,,,,,,,,,,,,,,,,,,,,,,
It's better to be climbing the ladder than to be over the hill!,,,,,,,,,,,,,,,,,,,,,,,,,,,,,
Happy Birthday to a smokin' hot chick!,,,,,,,,,,,,,,,,,,,,,,,,,,,,,
We've got the hose ready for your birthday candles!,,,,,,,,,,,,,,,,,,,,,,,,,,,,,
Happy Birthday to one hot mama!,,,,,,,,,,,,,,,,,,,,,,,,,,,,,
We heard your birthday was here so we called in some backup.,,,,,,,,,,,,,,,,,,,,,,,,,,,,,
Someone ring the alarm.....Mary's turning 50!,,,,,,,,,,,,,,,,,,,,,,,,,,,,,
Only halfway there! You're over the hump!,,,,,,,,,,,,,,,,,,,,,,,,,,,,,
It's all about you on this very special day! Happy Birthday!,,,,,,,,,,,,,,,,,,,,,,,,,,,,,
"Keep on fightin', Happy Birthday!",,,,,,,,,,,,,,,,,,,,,,,,,,,,,
Wishing you a very happy birthday!,,,,,,,,,,,,,,,,,,,,,,,,,,,,,
Thinking of you on your birthday!,,,,,,,,,,,,,,,,,,,,,,,,,,,,,
Sending happiness on your birthday!,,,,,,,,,,,,,,,,,,,,,,,,,,,,,
happy birthday to a very fiery woman,,,,,,,,,,,,,,,,,,,,,,,,,,,,,
Happy birthday to a person who knows how to get hot,,,,,,,,,,,,,,,,,,,,,,,,,,,,,
Enjoy your birthday.,,,,,,,,,,,,,,,,,,,,,,,,,,,,,
Happy birthday to a great person!,,,,,,,,,,,,,,,,,,,,,,,,,,,,,
hottie firefighters deserve kick-ass parties,,,,,,,,,,,,,,,,,,,,,,,,,,,,,
birthday parties are hot when you are there,,,,,,,,,,,,,,,,,,,,,,,,,,,,,
"It's time to ""cool"" things down after that fire your birthday cake started!",,,,,,,,,,,,,,,,,,,,,,,,,,,,,
may all of your birthday wishes come true,,,,,,,,,,,,,,,,,,,,,,,,,,,,,
Thanks and happy birthday to a true hero,,,,,,,,,,,,,,,,,,,,,,,,,,,,,
Hope the amount of candles needed for the cake do no start a fire,,,,,,,,,,,,,,,,,,,,,,,,,,,,,
happy 50th birthday,,,,,,,,,,,,,,,,,,,,,,,,,,,,,
Under fire!,,,,,,,,,,,,,,,,,,,,,,,,,,,,,
Birthdaylicious!,,,,,,,,,,,,,,,,,,,,,,,,,,,,,
"Half of your life!!!
Happy Cake day!
Great times!
Your own holiday.
Happy Happy!
Birthday Fire!",,,,,,,,,,,,,,,,,,,,,,,,,,,,,
Life is good,,,,,,,,,,,,,,,,,,,,,,,,,,,,,
Happy Middle age!,,,,,,,,,,,,,,,,,,,,,,,,,,,,,
Fire Up!!!,,,,,,,,,,,,,,,,,,,,,,,,,,,,,
Live long,,,,,,,,,,,,,,,,,,,,,,,,,,,,,
"You know you are getting old when the candles cost more than the cake. In your case, we might need to call the fire department.",,,,,,,,,,,,,,,,,,,,,,,,,,,,,
Regardless that you are a year older,,,,,,,,,,,,,,,,,,,,,,,,,,,,,
Happy birthday to the world's greatest firefighter.,,,,,,,,,,,,,,,,,,,,,,,,,,,,,
You still on hot smoking firefighter so don't put out the fire just yet. lol Happy Birthday,,,,,,,,,,,,,,,,,,,,,,,,,,,,,
Roses are Red and Fire is to So blow out the candles already before they melt. Happy Birthday!,,,,,,,,,,,,,,,,,,,,,,,,,,,,,
You have more years than the firehouse Dalmatian has spots. Happy Birthday!,,,,,,,,,,,,,,,,,,,,,,,,,,,,,
While you read this message another building burned down. Happy Birthday!,,,,,,,,,,,,,,,,,,,,,,,,,,,,,
Extinguishing years like fires. Happy Birthday!,,,,,,,,,,,,,,,,,,,,,,,,,,,,,
"Time to stop putting out fires, and retire. Happy Birthday!",,,,,,,,,,,,,,,,,,,,,,,,,,,,,
You're putting out more candles than fires. Happy Birthday!,,,,,,,,,,,,,,,,,,,,,,,,,,,,,
Over the hill... but still ready to party!,,,,,,,,,,,,,,,,,,,,,,,,,,,,,
Firefighter 5 - o,,,,,,,,,,,,,,,,,,,,,,,,,,,,,
