item,,,,,,,,,,,,,,,,,,,,,,,,,,,,,
Put out that fire!..started by birthday cake candles..Happy 50th,,,,,,,,,,,,,,,,,,,,,,,,,,,,,
Not too old to make difference..Happy 50th!,,,,,,,,,,,,,,,,,,,,,,,,,,,,,
You can fight fires..but can't fight father time..Happy 50th!,,,,,,,,,,,,,,,,,,,,,,,,,,,,,
50 is just a number!,,,,,,,,,,,,,,,,,,,,,,,,,,,,,
Your birth gave birth to my life!,,,,,,,,,,,,,,,,,,,,,,,,,,,,,
there is no better day to tell you how special you are to me!,,,,,,,,,,,,,,,,,,,,,,,,,,,,,
the best of the year will be celebrating your birthday!,,,,,,,,,,,,,,,,,,,,,,,,,,,,,
Happy Birthday to you!,,,,,,,,,,,,,,,,,,,,,,,,,,,,,
A fun birthday for a fun guy!,,,,,,,,,,,,,,,,,,,,,,,,,,,,,
Can you blow out all the candles?,,,,,,,,,,,,,,,,,,,,,,,,,,,,,
Have fun on your special day!,,,,,,,,,,,,,,,,,,,,,,,,,,,,,
Awesome birthday!,,,,,,,,,,,,,,,,,,,,,,,,,,,,,
Today is your special day!,,,,,,,,,,,,,,,,,,,,,,,,,,,,,
Yay happy birthday!,,,,,,,,,,,,,,,,,,,,,,,,,,,,,
Today is your day!,,,,,,,,,,,,,,,,,,,,,,,,,,,,,
Have fun today!,,,,,,,,,,,,,,,,,,,,,,,,,,,,,
Over the hill now down the hill!,,,,,,,,,,,,,,,,,,,,,,,,,,,,,
"Next stop, 51!",,,,,,,,,,,,,,,,,,,,,,,,,,,,,
"Happy Birthday,dawg!",,,,,,,,,,,,,,,,,,,,,,,,,,,,,
"Congratulations, you are older!",,,,,,,,,,,,,,,,,,,,,,,,,,,,,
You can put out my fire any day of the week.,,,,,,,,,,,,,,,,,,,,,,,,,,,,,
Over the hump!,,,,,,,,,,,,,,,,,,,,,,,,,,,,,
"You are older again, have fun!",,,,,,,,,,,,,,,,,,,,,,,,,,,,,
You are the best firefighter!,,,,,,,,,,,,,,,,,,,,,,,,,,,,,
"We didn't start the fire, but you'll always be burning. Happy 50th MARY!",,,,,,,,,,,,,,,,,,,,,,,,,,,,,
"You may fight 'em, but you fire burns bright. Happy birthday Mary!",,,,,,,,,,,,,,,,,,,,,,,,,,,,,
Happy birthday to our favorite gal!,,,,,,,,,,,,,,,,,,,,,,,,,,,,,
Happy birthday Mary. Keep fighting!,,,,,,,,,,,,,,,,,,,,,,,,,,,,,
"Keep shining bright, Mary. Happy birthday!",,,,,,,,,,,,,,,,,,,,,,,,,,,,,
Happy 50th birthday to the meanest chick we know!,,,,,,,,,,,,,,,,,,,,,,,,,,,,,
Happy 50th to our favorite fighter!,,,,,,,,,,,,,,,,,,,,,,,,,,,,,
Happy 50th Mary. Let's hope yours is a fire that never dies out!,,,,,,,,,,,,,,,,,,,,,,,,,,,,,
Is it getting hot in here or is it just you? Happy 50th Mary!,,,,,,,,,,,,,,,,,,,,,,,,,,,,,
"To the gal who puts the rest of us to shame, Happy Birthday Mary!",,,,,,,,,,,,,,,,,,,,,,,,,,,,,
Happy 50th birthday to the baddest girl we know!,,,,,,,,,,,,,,,,,,,,,,,,,,,,,
Keep kicking ass and taking names. Happy birthday Mary!,,,,,,,,,,,,,,,,,,,,,,,,,,,,,
"Hurry, Mary, the 50candle flames need ot be blown out!",,,,,,,,,,,,,,,,,,,,,,,,,,,,,
"You're a hotty, Mary!",,,,,,,,,,,,,,,,,,,,,,,,,,,,,
You light my fire - happy birthday!,,,,,,,,,,,,,,,,,,,,,,,,,,,,,
"Blow out the 50 candle flames, Mary!",,,,,,,,,,,,,,,,,,,,,,,,,,,,,
Hotty Birthday!,,,,,,,,,,,,,,,,,,,,,,,,,,,,,
"You blew out 49 flames, Mary - see you next year to blow out flame 50!",,,,,,,,,,,,,,,,,,,,,,,,,,,,,
Well you made it this far.  You might as well keep going.  Happy Birthday!,,,,,,,,,,,,,,,,,,,,,,,,,,,,,
"Happy Birthday, you old coot!",,,,,,,,,,,,,,,,,,,,,,,,,,,,,
You're still a firecracker at 50.,,,,,,,,,,,,,,,,,,,,,,,,,,,,,
50 and still on fire.,,,,,,,,,,,,,,,,,,,,,,,,,,,,,
You're a hot old woman! Happy birthday!,,,,,,,,,,,,,,,,,,,,,,,,,,,,,
We lit the candles on your cake and the house burned down.  Happy birthday anyway.,,,,,,,,,,,,,,,,,,,,,,,,,,,,,
50 and still Firing!,,,,,,,,,,,,,,,,,,,,,,,,,,,,,
Happy Birthday to the HOTTEST FIREFIGHTER I know!,,,,,,,,,,,,,,,,,,,,,,,,,,,,,
Still Climbing the ladder!,,,,,,,,,,,,,,,,,,,,,,,,,,,,,
It's getting hot in here!,,,,,,,,,,,,,,,,,,,,,,,,,,,,,
Burning 50!,,,,,,,,,,,,,,,,,,,,,,,,,,,,,
Turn up the Heat! Happy 50th!,,,,,,,,,,,,,,,,,,,,,,,,,,,,,
Put out the fire. You're 50!,,,,,,,,,,,,,,,,,,,,,,,,,,,,,
Hot 5-0!,,,,,,,,,,,,,,,,,,,,,,,,,,,,,
"Congratulations, now all the bs is over it gets better from here on",,,,,,,,,,,,,,,,,,,,,,,,,,,,,
"Congratulations, you made it this far in one piece",,,,,,,,,,,,,,,,,,,,,,,,,,,,,
Happy 30th birthday.50 is the new 30,,,,,,,,,,,,,,,,,,,,,,,,,,,,,
50 and still cool enough to put out the hottest of flames. Have a Happy Birthday Mary!,,,,,,,,,,,,,,,,,,,,,,,,,,,,,
We hope you have a HOT birthday Mary!,,,,,,,,,,,,,,,,,,,,,,,,,,,,,
50 and still blazing hot! Happy Birthday Mary,,,,,,,,,,,,,,,,,,,,,,,,,,,,,
"Sound the alarms, Mary's on fire!",,,,,,,,,,,,,,,,,,,,,,,,,,,,,
Have a hot and firey birthday!,,,,,,,,,,,,,,,,,,,,,,,,,,,,,
"If you can't blow out 50 birthday candles, you're not much of a fire fighter",,,,,,,,,,,,,,,,,,,,,,,,,,,,,
it's a good thing you're a firefighter with 50 birthday candles to deal with,,,,,,,,,,,,,,,,,,,,,,,,,,,,,
Happy Birthday! Don't let all the candles start a fire!,,,,,,,,,,,,,,,,,,,,,,,,,,,,,
I've been burning inside to wish you a happy birthday. Please don't hose me down!,,,,,,,,,,,,,,,,,,,,,,,,,,,,,
You're 50! You're a firefighter! You CAN blow out all these candles!,,,,,,,,,,,,,,,,,,,,,,,,,,,,,
I'm aflame with excitement about your birthday!,,,,,,,,,,,,,,,,,,,,,,,,,,,,,
Keep dousing fires and lighting up lives!,,,,,,,,,,,,,,,,,,,,,,,,,,,,,
Don't take a fire hose to the birthday cake!,,,,,,,,,,,,,,,,,,,,,,,,,,,,,
Keep lighting up the world!,,,,,,,,,,,,,,,,,,,,,,,,,,,,,
"Happy 50th birthday, here's another flame for you to put out.",,,,,,,,,,,,,,,,,,,,,,,,,,,,,
It's a fire! Your birthday cake needs some help.,,,,,,,,,,,,,,,,,,,,,,,,,,,,,
"This time, enjoy the burning candles",,,,,,,,,,,,,,,,,,,,,,,,,,,,,
Blow the candles out,,,,,,,,,,,,,,,,,,,,,,,,,,,,,
Let the candles burn out.,,,,,,,,,,,,,,,,,,,,,,,,,,,,,
Hate to give you these many candles to put out.,,,,,,,,,,,,,,,,,,,,,,,,,,,,,
"Sorry, ma'am, but your cake set off the sprinkler system.",,,,,,,,,,,,,,,,,,,,,,,,,,,,,
Don't get hosed!,,,,,,,,,,,,,,,,,,,,,,,,,,,,,
Fifty candles? Someone call the fire department!!!,,,,,,,,,,,,,,,,,,,,,,,,,,,,,
"For fire safety, please don't light all 50 candles at once!",,,,,,,,,,,,,,,,,,,,,,,,,,,,,
Happy Birthday! I hope your big day is full of relaxation and no worries.,,,,,,,,,,,,,,,,,,,,,,,,,,,,,
Hope you brought your equipment to your birthday party to put out that fire on the cake! Happy birthday!,,,,,,,,,,,,,,,,,,,,,,,,,,,,,
Only 50 candles? I've seen you put out worse.  Happy birthday!,,,,,,,,,,,,,,,,,,,,,,,,,,,,,
We're installing a handicapped ramp so you don't need to take the pole anymore.   Congratulations on make it over the hill!,,,,,,,,,,,,,,,,,,,,,,,,,,,,,
Don't set the house on fire with all those candles! Luckily you know how to put them out.,,,,,,,,,,,,,,,,,,,,,,,,,,,,,
We've got a fire truck standing by for that cake.,,,,,,,,,,,,,,,,,,,,,,,,,,,,,
Is that a four alarm fire on your cake? Nope! Just turning the big 5-0!,,,,,,,,,,,,,,,,,,,,,,,,,,,,,
"Don't worry about all those candles, I know you can put them out!",,,,,,,,,,,,,,,,,,,,,,,,,,,,,
"Here's to 50 more years of fighting fires

Lol",,,,,,,,,,,,,,,,,,,,,,,,,,,,,
"So you're turning 50?

Which is harder fighting fires or fighting aging?",,,,,,,,,,,,,,,,,,,,,,,,,,,,,
"I would rather for you to fight fires than to fight me.

Happy Birthday",,,,,,,,,,,,,,,,,,,,,,,,,,,,,
"To my favorite fire starter...

I mean firefighter.",,,,,,,,,,,,,,,,,,,,,,,,,,,,,
Have an explosive day.,,,,,,,,,,,,,,,,,,,,,,,,,,,,,
What a HOT 50 year old you are.  Happy Birthday Firewoman,,,,,,,,,,,,,,,,,,,,,,,,,,,,,
Don't light the house on fire celebrating,,,,,,,,,,,,,,,,,,,,,,,,,,,,,
You Light up the room Happy Birthday,,,,,,,,,,,,,,,,,,,,,,,,,,,,,
Never too old or too hot,,,,,,,,,,,,,,,,,,,,,,,,,,,,,
50 is the new 60 happy birthday,,,,,,,,,,,,,,,,,,,,,,,,,,,,,
Love to see you light up our world,,,,,,,,,,,,,,,,,,,,,,,,,,,,,
You are just starting the best half of your life,,,,,,,,,,,,,,,,,,,,,,,,,,,,,
You are like a good bottle of wine and age well,,,,,,,,,,,,,,,,,,,,,,,,,,,,,
Celebrate and have fun…it's your day,,,,,,,,,,,,,,,,,,,,,,,,,,,,,
That's a lot of candles!!!!  Have fun putting out the fire,,,,,,,,,,,,,,,,,,,,,,,,,,,,,
2* 25 =50  So party like you are two 25 year olds,,,,,,,,,,,,,,,,,,,,,,,,,,,,,
Blow the house down.  Happy Birthday,,,,,,,,,,,,,,,,,,,,,,,,,,,,,
"Wow, 50 already? You are definitely a healthy fighter! And by fighter, I mean FIRE-fighter! Happy Birthday, Mary!",,,,,,,,,,,,,,,,,,,,,,,,,,,,,
Have a wonderful day Mary! You made the world a better place. Happy 50th!,,,,,,,,,,,,,,,,,,,,,,,,,,,,,
"Mary, Mary, quite contrary. It's your 50th birthday, so enjoy it VERY.... much. Have a splendid day!",,,,,,,,,,,,,,,,,,,,,,,,,,,,,
"Happy birthday, Mary! Without you, the world would burn in flames. Have a happy 50th birthday!",,,,,,,,,,,,,,,,,,,,,,,,,,,,,
"Mary, today is your day! Relax and enjoy 50. 50 years of one great woman.",,,,,,,,,,,,,,,,,,,,,,,,,,,,,
"WHOA, The FIVE OH! Happy birthday, Mary! You bring the firefighter community a lot of merry.",,,,,,,,,,,,,,,,,,,,,,,,,,,,,
"Happy Birthday, Mary! Blow out the fire for your 50th birthday.",,,,,,,,,,,,,,,,,,,,,,,,,,,,,
There are people and then there is you... Happy Birthday Mary!,,,,,,,,,,,,,,,,,,,,,,,,,,,,,
Fight fire with fire... Happy Birthday Mary!,,,,,,,,,,,,,,,,,,,,,,,,,,,,,
Im sure you know how to put out the fire on these candles. Happy Birthday Mary.,,,,,,,,,,,,,,,,,,,,,,,,,,,,,
Here is to lighting a fire under your butt... Happy Birthday Mary!,,,,,,,,,,,,,,,,,,,,,,,,,,,,,
The world wouldnt be the same without you. Happy Birthday Mary!,,,,,,,,,,,,,,,,,,,,,,,,,,,,,
"I enjoy the moments with you and hope the fire is still in you, happy 50th birthday",,,,,,,,,,,,,,,,,,,,,,,,,,,,,
Happy Birthday firebug,,,,,,,,,,,,,,,,,,,,,,,,,,,,,
I hope you'll become the greater firefighter in the later years,,,,,,,,,,,,,,,,,,,,,,,,,,,,,
You're the best fireman ever,,,,,,,,,,,,,,,,,,,,,,,,,,,,,
I see that you're older but you still have much fire in your heart,,,,,,,,,,,,,,,,,,,,,,,,,,,,,
"Happy birthday, hero!",,,,,,,,,,,,,,,,,,,,,,,,,,,,,
Today marks the 50th year of awesome!,,,,,,,,,,,,,,,,,,,,,,,,,,,,,
This card is dedicated to an amazing hero!,,,,,,,,,,,,,,,,,,,,,,,,,,,,,
Congratulations on surviving the heat!,,,,,,,,,,,,,,,,,,,,,,,,,,,,,
"Happy birthday, Mary!",,,,,,,,,,,,,,,,,,,,,,,,,,,,,
Don't use this as an excuse to slow down! Happy birthday Mary!,,,,,,,,,,,,,,,,,,,,,,,,,,,,,
Happy Brithday Mary! We won't tell everyone you turn 50 today!,,,,,,,,,,,,,,,,,,,,,,,,,,,,,
"Happy birthday Mary! Now seriously, take off the gas mask!",,,,,,,,,,,,,,,,,,,,,,,,,,,,,
"It's a three alarm blaze! No, that's just Mary being hot. Happy Birthday!",,,,,,,,,,,,,,,,,,,,,,,,,,,,,
Happy Birthday! May your light shine on for another 50 years!,,,,,,,,,,,,,,,,,,,,,,,,,,,,,
Happy Birthday! Good thing you're a firefighter,,,,,,,,,,,,,,,,,,,,,,,,,,,,,
Happy Birthday Mary! Now quit reading and get back to work!,,,,,,,,,,,,,,,,,,,,,,,,,,,,,
Happy 50th Mary! The only fire that could never be put out is yours!,,,,,,,,,,,,,,,,,,,,,,,,,,,,,
Turn on the siren someone's turning 50! Happy Birthday,,,,,,,,,,,,,,,,,,,,,,,,,,,,,
Don't be smoked alarmed about turning 50,,,,,,,,,,,,,,,,,,,,,,,,,,,,,
Happy 5 decade on fire.,,,,,,,,,,,,,,,,,,,,,,,,,,,,,
Happy birthday to a Hero.,,,,,,,,,,,,,,,,,,,,,,,,,,,,,
Happy 50th birthday!,,,,,,,,,,,,,,,,,,,,,,,,,,,,,
"Stop, drop and roll! Happy birthday!",,,,,,,,,,,,,,,,,,,,,,,,,,,,,
Happy 50th! Good thing you are a fire fighter with all these candles.,,,,,,,,,,,,,,,,,,,,,,,,,,,,,
Have a smoking hot 50th!,,,,,,,,,,,,,,,,,,,,,,,,,,,,,
"To a hot momma on her birthday,",,,,,,,,,,,,,,,,,,,,,,,,,,,,,
"Happy 50 Mary, here's your one day to have tons of little fires started in your name, do what you do best and put them out!",,,,,,,,,,,,,,,,,,,,,,,,,,,,,
50? You still put out fires like you're 25! Happy Birthday!,,,,,,,,,,,,,,,,,,,,,,,,,,,,,
Here's to another 50 years of saving lives!,,,,,,,,,,,,,,,,,,,,,,,,,,,,,
You're a fire that's been burning for 50 years! Happy birthday!,,,,,,,,,,,,,,,,,,,,,,,,,,,,,
"Happy Birthday, Mary!",,,,,,,,,,,,,,,,,,,,,,,,,,,,,
"Everyone agrees, there's something about Mary. Maybe it's all that junk in her firetruck!",,,,,,,,,,,,,,,,,,,,,,,,,,,,,
Only YOU can prevent Birthday fires!,,,,,,,,,,,,,,,,,,,,,,,,,,,,,
50?! You don't look a day over 49 and 364 days!,,,,,,,,,,,,,,,,,,,,,,,,,,,,,
Just because you're 50 doesn't mean you're not still smoking!,,,,,,,,,,,,,,,,,,,,,,,,,,,,,
"Don't worry, putting this fire out will be a piece of cake!",,,,,,,,,,,,,,,,,,,,,,,,,,,,,
"That many candles on one cake is surely a fire hazard. Luckily, we know just who to call!",,,,,,,,,,,,,,,,,,,,,,,,,,,,,
"Happy Birthday, thanks for keeping me safe everyday",,,,,,,,,,,,,,,,,,,,,,,,,,,,,
"Youve put out hundreds of fires, now here's and easy one",,,,,,,,,,,,,,,,,,,,,,,,,,,,,
"You're flame has burned for 50 years, lets hope for another 50 more.",,,,,,,,,,,,,,,,,,,,,,,,,,,,,
"Happy Birthday Mary, I bet you cant put out these candles",,,,,,,,,,,,,,,,,,,,,,,,,,,,,
"Most fires get put out with time, but not yours!",,,,,,,,,,,,,,,,,,,,,,,,,,,,,
Happy 50th birthday!,,,,,,,,,,,,,,,,,,,,,,,,,,,,,
You're still smoking!,,,,,,,,,,,,,,,,,,,,,,,,,,,,,
No one is ever going to put your flame out!,,,,,,,,,,,,,,,,,,,,,,,,,,,,,
You can use my hose anytime!,,,,,,,,,,,,,,,,,,,,,,,,,,,,,
You make me feel like I'm on fire!,,,,,,,,,,,,,,,,,,,,,,,,,,,,,
You're fire is never going to be extinguished!,,,,,,,,,,,,,,,,,,,,,,,,,,,,,
It's getting HOT in here!!! Oh not wait it's just Mary in her uniform. Happy Bday!,,,,,,,,,,,,,,,,,,,,,,,,,,,,,
They say 50 is the new 40. I say once you reach 25 the numbers don't go any higher. Happy 25th Birthday Mary!,,,,,,,,,,,,,,,,,,,,,,,,,,,,,
Happy Birthday Mary! Party like it's Hot but keep the fire hose a home.,,,,,,,,,,,,,,,,,,,,,,,,,,,,,
Happy birthday! Call the fire department cause that cake is on fire!,,,,,,,,,,,,,,,,,,,,,,,,,,,,,
"Happy birthday, take it easy on those candles!",,,,,,,,,,,,,,,,,,,,,,,,,,,,,
"Happy birthday, your still hot! Time to put out those fires!",,,,,,,,,,,,,,,,,,,,,,,,,,,,,
"What the blazes, it's your birthday!",,,,,,,,,,,,,,,,,,,,,,,,,,,,,
For the birthday girl who puts out more than candles!,,,,,,,,,,,,,,,,,,,,,,,,,,,,,
Burn it up for your birthday!,,,,,,,,,,,,,,,,,,,,,,,,,,,,,
"You may be a firefighter, but today, you're the 5-0!",,,,,,,,,,,,,,,,,,,,,,,,,,,,,
Combust a move!,,,,,,,,,,,,,,,,,,,,,,,,,,,,,
Burn out the Birthday!,,,,,,,,,,,,,,,,,,,,,,,,,,,,,
"Your one more rung on the ladder up, but you still have a long way to go.",,,,,,,,,,,,,,,,,,,,,,,,,,,,,
Here are 50 small fires you wont need a hose to douse,,,,,,,,,,,,,,,,,,,,,,,,,,,,,
"For all the people who you have allowed to see there next birthday, hers a happy one for you.",,,,,,,,,,,,,,,,,,,,,,,,,,,,,
"* With a dog  on the cover
Heres a spot for every year, happy birthday",,,,,,,,,,,,,,,,,,,,,,,,,,,,,
"Happy birthday, may your light continue to be the brightest flame of all.",,,,,,,,,,,,,,,,,,,,,,,,,,,,,
Turning 50 = still too hot to handle!,,,,,,,,,,,,,,,,,,,,,,,,,,,,,
Is 50 a hot number or what?! = Guess you put out that fire already!,,,,,,,,,,,,,,,,,,,,,,,,,,,,,
You're almost 50!! When will your fire finally go out?!,,,,,,,,,,,,,,,,,,,,,,,,,,,,,
Happy birthday!! We might need to have the fire trucks on standby when we set up your candles!,,,,,,,,,,,,,,,,,,,,,,,,,,,,,
You better have your uniform on when you blow out your candles!,,,,,,,,,,,,,,,,,,,,,,,,,,,,,
You're almost 50 and you are on fire!,,,,,,,,,,,,,,,,,,,,,,,,,,,,,
Happy Birthday Mary!,,,,,,,,,,,,,,,,,,,,,,,,,,,,,
"Better call some of your colleagues to come put out that fire... oh wait, that's your cake!

Happy Birthday!",,,,,,,,,,,,,,,,,,,,,,,,,,,,,
Congrats on your first of many 49th birthday celebrations - Happy Birthday!,,,,,,,,,,,,,,,,,,,,,,,,,,,,,
"Thanks for the service you have done for your community - 

Happy Birthday!",,,,,,,,,,,,,,,,,,,,,,,,,,,,,
Keep adding oil to your brilliant firey self!,,,,,,,,,,,,,,,,,,,,,,,,,,,,,
May you continue to be radiant and bring light to all those around you!,,,,,,,,,,,,,,,,,,,,,,,,,,,,,
"With so many candles, don't start a fire! happy birthday",,,,,,,,,,,,,,,,,,,,,,,,,,,,,
Don't extinguish your fire as your reach the next chapter in life,,,,,,,,,,,,,,,,,,,,,,,,,,,,,
You're life has been on fire because you you're hot and fierce!,,,,,,,,,,,,,,,,,,,,,,,,,,,,,
Happy 50th hot stuff!!,,,,,,,,,,,,,,,,,,,,,,,,,,,,,
Do you get to drive the truck now?,,,,,,,,,,,,,,,,,,,,,,,,,,,,,
3 alarm fire at your house?!? No wait that's just the candles on your cake!,,,,,,,,,,,,,,,,,,,,,,,,,,,,,
"Put the extinguisher away, we're lighting the roof on fire today!",,,,,,,,,,,,,,,,,,,,,,,,,,,,,
Your gonna need the hose and crew for all those candles,,,,,,,,,,,,,,,,,,,,,,,,,,,,,
"Instead of putting one out , let's make a big one for your special day!",,,,,,,,,,,,,,,,,,,,,,,,,,,,,
"To one hot lady, Happy Birthday!",,,,,,,,,,,,,,,,,,,,,,,,,,,,,
I know age never leaves you feeling hosed. Happy Birthday!,,,,,,,,,,,,,,,,,,,,,,,,,,,,,
Here's to another rung on the ladder! Happy Birthday!,,,,,,,,,,,,,,,,,,,,,,,,,,,,,
50 is the new awesome!,,,,,,,,,,,,,,,,,,,,,,,,,,,,,
"Mary, you set the world on fire.",,,,,,,,,,,,,,,,,,,,,,,,,,,,,
Thank you Marry for being a light to the world.,,,,,,,,,,,,,,,,,,,,,,,,,,,,,
Happy Birthday You old firefighter!,,,,,,,,,,,,,,,,,,,,,,,,,,,,,
With all those candles we're gonna need a pro to put it out.,,,,,,,,,,,,,,,,,,,,,,,,,,,,,
Happy Birthday! Do we need a permit to light this many candles on the cake?,,,,,,,,,,,,,,,,,,,,,,,,,,,,,
Happy Birthday Mary! Come help us light the cake!,,,,,,,,,,,,,,,,,,,,,,,,,,,,,
Come slide down a pole and join your Party! Happy Birthday!,,,,,,,,,,,,,,,,,,,,,,,,,,,,,
We got a fire of a cake burning for you!,,,,,,,,,,,,,,,,,,,,,,,,,,,,,
The temperature is rising and so is your age. Happy 50th Birthday!,,,,,,,,,,,,,,,,,,,,,,,,,,,,,
"I don't know which is best, wearing a firehat or turning half a century. Happy Birthday.",,,,,,,,,,,,,,,,,,,,,,,,,,,,,
"Stop, drop and roll because it is your birthday!",,,,,,,,,,,,,,,,,,,,,,,,,,,,,
I hope you have a wonderful day - you deserve it!,,,,,,,,,,,,,,,,,,,,,,,,,,,,,
"Thank you for your service to our community, Mary. Happy Birthday!",,,,,,,,,,,,,,,,,,,,,,,,,,,,,
Here's hoping your next 50 are as great as the first!,,,,,,,,,,,,,,,,,,,,,,,,,,,,,
Happy Birthday Mary!,,,,,,,,,,,,,,,,,,,,,,,,,,,,,
It takes guts to be a lady firefighter - Thanks for hanging in there! Best wishes on your birthday!,,,,,,,,,,,,,,,,,,,,,,,,,,,,,
Wishing you all the best on your birthday!,,,,,,,,,,,,,,,,,,,,,,,,,,,,,
"If you ever have trouble getting up in the morning, call me. I'll come over and light a fire under you. Happy Birthday.",,,,,,,,,,,,,,,,,,,,,,,,,,,,,
Wishing you a Happy Half Century,,,,,,,,,,,,,,,,,,,,,,,,,,,,,
"I was going to get you a card with a picture of a hot firefighter on the front, but then I thought, ""Well, she sees that every day!""",,,,,,,,,,,,,,,,,,,,,,,,,,,,,
You're hot!,,,,,,,,,,,,,,,,,,,,,,,,,,,,,
,,,,,,,,,,,,,,,,,,,,,,,,,,,,,
"Mary, the girl on fire!",,,,,,,,,,,,,,,,,,,,,,,,,,,,,
What did one firefighter say to the other firefighter?,,,,,,,,,,,,,,,,,,,,,,,,,,,,,
"Mary, Mary, Pants on Fire!",,,,,,,,,,,,,,,,,,,,,,,,,,,,,
You're on fire!,,,,,,,,,,,,,,,,,,,,,,,,,,,,,
At least if your candles set things ablaze you'll have some help putting the flames out!,,,,,,,,,,,,,,,,,,,,,,,,,,,,,
You're aflame!,,,,,,,,,,,,,,,,,,,,,,,,,,,,,
Fifty is nifty!,,,,,,,,,,,,,,,,,,,,,,,,,,,,,
Congratulations on making it to 50!,,,,,,,,,,,,,,,,,,,,,,,,,,,,,
Happy Birthday!,,,,,,,,,,,,,,,,,,,,,,,,,,,,,
You may need a fire hose to to put out all of these candles!,,,,,,,,,,,,,,,,,,,,,,,,,,,,,
The flames of your age mean more as time passes by.,,,,,,,,,,,,,,,,,,,,,,,,,,,,,
Happy birthday! Dont sizzle out!,,,,,,,,,,,,,,,,,,,,,,,,,,,,,
50 years and still putting out large fires. Starting with your cake!,,,,,,,,,,,,,,,,,,,,,,,,,,,,,
Another smoking birthday!,,,,,,,,,,,,,,,,,,,,,,,,,,,,,
The older you get the more fire is added to your cake!,,,,,,,,,,,,,,,,,,,,,,,,,,,,,
"Happy Birthday, Mary! To a long and prosperous half century.",,,,,,,,,,,,,,,,,,,,,,,,,,,,,
Don't burn up for your 50!,,,,,,,,,,,,,,,,,,,,,,,,,,,,,
Hope you'll be there to put out the fire on the cake and in life for another good 50!,,,,,,,,,,,,,,,,,,,,,,,,,,,,,
"Happy Birthday, hero!",,,,,,,,,,,,,,,,,,,,,,,,,,,,,
Cheers to a great 50 years spent saving lives,,,,,,,,,,,,,,,,,,,,,,,,,,,,,
Happy Birthday Mary! Blow out the candles with your hydrant!,,,,,,,,,,,,,,,,,,,,,,,,,,,,,
fire hose your way to a good birth day!,,,,,,,,,,,,,,,,,,,,,,,,,,,,,
Come and rescue me with your fire truck!,,,,,,,,,,,,,,,,,,,,,,,,,,,,,
A hero for another year!,,,,,,,,,,,,,,,,,,,,,,,,,,,,,
Happy Birthday! 50 years is a milestone!,,,,,,,,,,,,,,,,,,,,,,,,,,,,,
"Happy Bday Mary.

Fight Strong. Another 50 Years awaits",,,,,,,,,,,,,,,,,,,,,,,,,,,,,
"Mary, Happy Birthday. For 50 years you've been fighting; here's to 50 more",,,,,,,,,,,,,,,,,,,,,,,,,,,,,
The Big 5 0 Have a big birthday bash Mary,,,,,,,,,,,,,,,,,,,,,,,,,,,,,
"Happy Birthday Mary, may it bring you much joy.",,,,,,,,,,,,,,,,,,,,,,,,,,,,,
"Happy Bday Mary, you're going to need a big hose for all those candles!",,,,,,,,,,,,,,,,,,,,,,,,,,,,,
Happy Birthday Mary. Now get on that fire pole and show us what you've got!,,,,,,,,,,,,,,,,,,,,,,,,,,,,,
"DO they have special Firetruck for the Elderly? Happy 50th,  Mary",,,,,,,,,,,,,,,,,,,,,,,,,,,,,
Mary had a little lamb...... and a firetruck. Happy Bday Kid.,,,,,,,,,,,,,,,,,,,,,,,,,,,,,
"Get your extinguisher ready, Mary is a hot 50. Happy Birthday!",,,,,,,,,,,,,,,,,,,,,,,,,,,,,
Cool me off Mary!,,,,,,,,,,,,,,,,,,,,,,,,,,,,,
It's easier to take down a fire at 50! Happy Birthday Mary.,,,,,,,,,,,,,,,,,,,,,,,,,,,,,
Happy 50th Birthday Mary!,,,,,,,,,,,,,,,,,,,,,,,,,,,,,
Birthday wishes to the firefighter.,,,,,,,,,,,,,,,,,,,,,,,,,,,,,
Still HOT at 50!,,,,,,,,,,,,,,,,,,,,,,,,,,,,,
Happy Birthday to a hottie!,,,,,,,,,,,,,,,,,,,,,,,,,,,,,
Mary is still fighting fires at 50!,,,,,,,,,,,,,,,,,,,,,,,,,,,,,
Might need to call the firefighters in to put out the candles!,,,,,,,,,,,,,,,,,,,,,,,,,,,,,
"Happy ""hot"" 50th",,,,,,,,,,,,,,,,,,,,,,,,,,,,,
"Get ready to call the fire department, we are about to light the 50 candles!!",,,,,,,,,,,,,,,,,,,,,,,,,,,,,
Hope your 50th is very hot and cool.,,,,,,,,,,,,,,,,,,,,,,,,,,,,,
Have a hot birthday!,,,,,,,,,,,,,,,,,,,,,,,,,,,,,
"You are such a fire in my underpants, enjoy your birthday!",,,,,,,,,,,,,,,,,,,,,,,,,,,,,
may you enjoy your birthday with flames.,,,,,,,,,,,,,,,,,,,,,,,,,,,,,
"You have fought many,
Ur achievements uncanny,
Fifty u celebrate now,
To you all of us bow.
May u live many,
Happy birthday mary!",,,,,,,,,,,,,,,,,,,,,,,,,,,,,
"Out of the pan and into the fire! Happy birthday, Mary!",,,,,,,,,,,,,,,,,,,,,,,,,,,,,
I hope you have a birthday that lights your fire!,,,,,,,,,,,,,,,,,,,,,,,,,,,,,
Have a birthday that is on fire.,,,,,,,,,,,,,,,,,,,,,,,,,,,,,
It's time to put out the fire on all of those candles!,,,,,,,,,,,,,,,,,,,,,,,,,,,,,
Mary's on fire for her birthday.,,,,,,,,,,,,,,,,,,,,,,,,,,,,,
"Happy 50th birthday, may you have many more!",,,,,,,,,,,,,,,,,,,,,,,,,,,,,
"Mary, Mary, not quite so contrary! Happy 50th!",,,,,,,,,,,,,,,,,,,,,,,,,,,,,
"This girl is on Fire.......
Happy birthday!",,,,,,,,,,,,,,,,,,,,,,,,,,,,,
Here it to 50 more years...,,,,,,,,,,,,,,,,,,,,,,,,,,,,,
"Happy Birthday Mary, Hope we are able to thank you enough",,,,,,,,,,,,,,,,,,,,,,,,,,,,,
"Half a century Mary, that is great!",,,,,,,,,,,,,,,,,,,,,,,,,,,,,
Happy Birthday Mary,,,,,,,,,,,,,,,,,,,,,,,,,,,,,
"Mary had a little lamb, but she wanted to put out fires..she becake",,,,,,,,,,,,,,,,,,,,,,,,,,,,,
"Firefighting mary, you are our hero! happy birthday",,,,,,,,,,,,,,,,,,,,,,,,,,,,,
You are a great human being - Happy Birthday,,,,,,,,,,,,,,,,,,,,,,,,,,,,,
Heat me up with 50 years of fire birthdays!,,,,,,,,,,,,,,,,,,,,,,,,,,,,,
"Don't let old age cool you of. HEAT IT UP!
Happy birthday!",,,,,,,,,,,,,,,,,,,,,,,,,,,,,
"Start of the fire of a whole new birthday!
Feel that heat girl!",,,,,,,,,,,,,,,,,,,,,,,,,,,,,
"There are so many candles on your cake, the ISS will think there's a fire down here!",,,,,,,,,,,,,,,,,,,,,,,,,,,,,
"Light my fire!
Happy 50th Birthday!",,,,,,,,,,,,,,,,,,,,,,,,,,,,,
Turn off the sprinklers and let this fire turn up the heat! Happy Birthday!,,,,,,,,,,,,,,,,,,,,,,,,,,,,,
Stoke up the flames and get this party roaring!,,,,,,,,,,,,,,,,,,,,,,,,,,,,,
"Burn baby burn!
Happy 50th Mary!",,,,,,,,,,,,,,,,,,,,,,,,,,,,,
Fire birthday for a firey girl!,,,,,,,,,,,,,,,,,,,,,,,,,,,,,
"Today is your day! Put away the extinguishers and bring out the fuel!
Happy birthday!",,,,,,,,,,,,,,,,,,,,,,,,,,,,,
"Happy Birthday Mary, the young firefighter!",,,,,,,,,,,,,,,,,,,,,,,,,,,,,
Happy Birthday to a great Firefighter!,,,,,,,,,,,,,,,,,,,,,,,,,,,,,
Fighting fires keeps you looking no more than a day over 30. Happy Birthday Mary.,,,,,,,,,,,,,,,,,,,,,,,,,,,,,
"Now that you're 50, let's go get hosed!",,,,,,,,,,,,,,,,,,,,,,,,,,,,,
Smokin' hot at 50!,,,,,,,,,,,,,,,,,,,,,,,,,,,,,
You are an inspiration to everyone you meet. Happy Birthday!,,,,,,,,,,,,,,,,,,,,,,,,,,,,,
"You risk your life to burn fire out for others, now it's time you turn out the fire of this candle for yourself! Happy Birthday!",,,,,,,,,,,,,,,,,,,,,,,,,,,,,
Happy Birthday Mary!,,,,,,,,,,,,,,,,,,,,,,,,,,,,,
"You risk your lives to save others, here's our way of telling you thank you! Happy Birthday Mary!",,,,,,,,,,,,,,,,,,,,,,,,,,,,,
May the fire in you always burn brightly. Happy Birthday Mary!,,,,,,,,,,,,,,,,,,,,,,,,,,,,,
"Happy 50th Birthday, Mary!",,,,,,,,,,,,,,,,,,,,,,,,,,,,,
You're burning 50 candles at both ends!,,,,,,,,,,,,,,,,,,,,,,,,,,,,,
"911, don't worry. It's just Mary's birthday!",,,,,,,,,,,,,,,,,,,,,,,,,,,,,
50 candles? Good thing you're a fire fighter!,,,,,,,,,,,,,,,,,,,,,,,,,,,,,
You might want to use the big hose to blow this many candles out!,,,,,,,,,,,,,,,,,,,,,,,,,,,,,
"Ring the sirens, it's Mary's birthday!",,,,,,,,,,,,,,,,,,,,,,,,,,,,,
