item,,,,,,,,,,,,,,,,,,,,,,,,,,,,,
"In case your age made you forget, just blow on the candles, no water needed. Happy Birthday!",,,,,,,,,,,,,,,,,,,,,,,,,,,,,
"Happy Birthday to you, Life Saver!",,,,,,,,,,,,,,,,,,,,,,,,,,,,,
Happy Birthday to the best lady around!,,,,,,,,,,,,,,,,,,,,,,,,,,,,,
Over the Hill and still putting out fires! Happy Birthday,,,,,,,,,,,,,,,,,,,,,,,,,,,,,
Wishing another happy year to the woman who saves so many people every year!,,,,,,,,,,,,,,,,,,,,,,,,,,,,,
"Happy Birthday, at least we know you can safely put out your own candles.",,,,,,,,,,,,,,,,,,,,,,,,,,,,,
"Over The Hill, but still saving lives. Happy Birthday!",,,,,,,,,,,,,,,,,,,,,,,,,,,,,
Happy Birthday!,,,,,,,,,,,,,,,,,,,,,,,,,,,,,
"Putting out fires, but not the one in my heart for you, Mary. Happy Birthday!",,,,,,,,,,,,,,,,,,,,,,,,,,,,,
"50 years the world was lucky enough to have you in it. Happy Birthday, Mary!",,,,,,,,,,,,,,,,,,,,,,,,,,,,,
"50 and still hot! Happy Birthday, Mary!",,,,,,,,,,,,,,,,,,,,,,,,,,,,,
Age is just a number.,,,,,,,,,,,,,,,,,,,,,,,,,,,,,
"50 years later, and you look even better.",,,,,,,,,,,,,,,,,,,,,,,,,,,,,
"Another year, another present.",,,,,,,,,,,,,,,,,,,,,,,,,,,,,
Here's to another 50 years!  Happy Birthday!,,,,,,,,,,,,,,,,,,,,,,,,,,,,,
Have a happy birthday and a happy year!,,,,,,,,,,,,,,,,,,,,,,,,,,,,,
"It's not a fire, it's just the candles on your birthday cake!",,,,,,,,,,,,,,,,,,,,,,,,,,,,,
Happy Birthday to a HOT 50 year old!,,,,,,,,,,,,,,,,,,,,,,,,,,,,,
"50 years old, and still smokin!",,,,,,,,,,,,,,,,,,,,,,,,,,,,,
Fighting fires while staying young at heart.  Happy Birthday!,,,,,,,,,,,,,,,,,,,,,,,,,,,,,
"Is that a fire engine siren I hear, or is it a celebration for your 50th birthday?",,,,,,,,,,,,,,,,,,,,,,,,,,,,,
"Happy Birthday!

May you have a fun filled day on this day.",,,,,,,,,,,,,,,,,,,,,,,,,,,,,
"Ring the bell!!!

It's your birthday!!!!",,,,,,,,,,,,,,,,,,,,,,,,,,,,,
Be blessed on your special day!,,,,,,,,,,,,,,,,,,,,,,,,,,,,,
Here's hoping someone rescues from the flames of your own hot flashes this year.,,,,,,,,,,,,,,,,,,,,,,,,,,,,,
"The roof is on fire, and so is your birthday cake.",,,,,,,,,,,,,,,,,,,,,,,,,,,,,
This year it might finally be time to get out the hose.,,,,,,,,,,,,,,,,,,,,,,,,,,,,,
Getting over the hill is scary...but not as scary as running into a burning building!,,,,,,,,,,,,,,,,,,,,,,,,,,,,,
Happy Birthday you are one in a million!,,,,,,,,,,,,,,,,,,,,,,,,,,,,,
"Happy birthday deepest from my soul, enjoy yourself",,,,,,,,,,,,,,,,,,,,,,,,,,,,,
"Happy Birthday, you are now 100!!!",,,,,,,,,,,,,,,,,,,,,,,,,,,,,
"How does it feel to turn 150!, Happy birthday my dear",,,,,,,,,,,,,,,,,,,,,,,,,,,,,
I can't believe your 50.  You don't look a day over 30!! Happy Birthday Mary!!,,,,,,,,,,,,,,,,,,,,,,,,,,,,,
"It's the Big 50.  Just like taking on a hit fire, You are approaching it with style and grace.  Happy Birthday Mary!!",,,,,,,,,,,,,,,,,,,,,,,,,,,,,
Mary!!  Happy Fiftieth!,,,,,,,,,,,,,,,,,,,,,,,,,,,,,
"Happy 50th.  Hope you have a great one!
Firewoman, you make all of us happy with your smile and wit.  Happy Five 0!!
Burning Hot Girl, Have a Happy Fiftieth.
50 has never looked so good.",,,,,,,,,,,,,,,,,,,,,,,,,,,,,
"Hopefully, you won't need an extinguisher for the 50 candles.",,,,,,,,,,,,,,,,,,,,,,,,,,,,,
"FIRE!!!! FIRE!!!! AHHH!!! Now that I have your attention: Happy Birthday, Mary.",,,,,,,,,,,,,,,,,,,,,,,,,,,,,
"Mary, you extinguish the flames of old age.",,,,,,,,,,,,,,,,,,,,,,,,,,,,,
50 Years Old and Still Full of Fire,,,,,,,,,,,,,,,,,,,,,,,,,,,,,
"Hats off to ya, Mary! [picture of a fire helmet]",,,,,,,,,,,,,,,,,,,,,,,,,,,,,
Old Age is Tougher Than a Burning Building. And You're Tougher Than Both.,,,,,,,,,,,,,,,,,,,,,,,,,,,,,
"You are a valued human being, Mary.",,,,,,,,,,,,,,,,,,,,,,,,,,,,,
"[lyrics to ""Full of Fire"" by Al Green]",,,,,,,,,,,,,,,,,,,,,,,,,,,,,
hottie with a body! happy birthday,,,,,,,,,,,,,,,,,,,,,,,,,,,,,
you can put my fire out any time,,,,,,,,,,,,,,,,,,,,,,,,,,,,,
climb the ladder to my heart,,,,,,,,,,,,,,,,,,,,,,,,,,,,,
youre too hot to handle,,,,,,,,,,,,,,,,,,,,,,,,,,,,,
You have a long hose!,,,,,,,,,,,,,,,,,,,,,,,,,,,,,
warning... hot do dont touch,,,,,,,,,,,,,,,,,,,,,,,,,,,,,
i love you even thour you're a hot mess,,,,,,,,,,,,,,,,,,,,,,,,,,,,,
youre fired,,,,,,,,,,,,,,,,,,,,,,,,,,,,,
i'd catch my house on fire just so you could come,,,,,,,,,,,,,,,,,,,,,,,,,,,,,
"That isn't a fire, that's how old Mary is!",,,,,,,,,,,,,,,,,,,,,,,,,,,,,
50 years later and Mary is still fierier hot,,,,,,,,,,,,,,,,,,,,,,,,,,,,,
Half a century old today,,,,,,,,,,,,,,,,,,,,,,,,,,,,,
Burn those blazin' candles,,,,,,,,,,,,,,,,,,,,,,,,,,,,,
You are the one I'd call if I ever felt the heat.  LOL,,,,,,,,,,,,,,,,,,,,,,,,,,,,,
Happy Birthday to a brave and caring person.,,,,,,,,,,,,,,,,,,,,,,,,,,,,,
Cool head but a warm heart. Glad you have you as my friend.,,,,,,,,,,,,,,,,,,,,,,,,,,,,,
Happy Birthday! You are on call to celebrate!,,,,,,,,,,,,,,,,,,,,,,,,,,,,,
Time to put out some flames,,,,,,,,,,,,,,,,,,,,,,,,,,,,,
After 40 years your light is still burning strong,,,,,,,,,,,,,,,,,,,,,,,,,,,,,
After 50 years your light is still burning strong,,,,,,,,,,,,,,,,,,,,,,,,,,,,,
"The candles are supposed to be on fire, Happy Birthday",,,,,,,,,,,,,,,,,,,,,,,,,,,,,
Don't spray the cake with a hose! Happy Birthday,,,,,,,,,,,,,,,,,,,,,,,,,,,,,
"I'm cracking under pressure, happy birthday.",,,,,,,,,,,,,,,,,,,,,,,,,,,,,
Happy Birthday to the best firefighter in the world!,,,,,,,,,,,,,,,,,,,,,,,,,,,,,
I was thinking about getting you a dalmation but I went with this card instead. Happy Birthday,,,,,,,,,,,,,,,,,,,,,,,,,,,,,
Remember you'll always look as good as you did when you were 29 ,,,,,,,,,,,,,,,,,,,,,,,,,,,,,
Thanks for being there! Happy BD,,,,,,,,,,,,,,,,,,,,,,,,,,,,,
Another year passes! Happy birthday! Enjoy.,,,,,,,,,,,,,,,,,,,,,,,,,,,,,
Thanks for the cake! Happy day of birth!,,,,,,,,,,,,,,,,,,,,,,,,,,,,,
Happy birthday to one of the best!,,,,,,,,,,,,,,,,,,,,,,,,,,,,,
"50 down, 50 to go",,,,,,,,,,,,,,,,,,,,,,,,,,,,,
Today you have to put out 50 fires,,,,,,,,,,,,,,,,,,,,,,,,,,,,,
"Use your breath, not the hose.",,,,,,,,,,,,,,,,,,,,,,,,,,,,,
You're on fire!,,,,,,,,,,,,,,,,,,,,,,,,,,,,,
Calling all Fire Fighters we have a bomb fire on a cake,,,,,,,,,,,,,,,,,,,,,,,,,,,,,
Hurry and Blow it's a Cake Inferno,,,,,,,,,,,,,,,,,,,,,,,,,,,,,
"Lordy, Lordy, Marys not 40",,,,,,,,,,,,,,,,,,,,,,,,,,,,,
"who who's 50, now ain't that nifty",,,,,,,,,,,,,,,,,,,,,,,,,,,,,
"Happy 50th Birthday, Mary!",,,,,,,,,,,,,,,,,,,,,,,,,,,,,
"Happy Birthday Mary!  

Can the firefighter blow out 50 candles in one breath?",,,,,,,,,,,,,,,,,,,,,,,,,,,,,
"Celebrating Half a Century, Mary!",,,,,,,,,,,,,,,,,,,,,,,,,,,,,
"Happy Birthday, Mary!  Can the firefighter extinguish 50 candles with one breath?",,,,,,,,,,,,,,,,,,,,,,,,,,,,,
"Happy Birthday, Mary!  Hopefully you won't have to put 50 candle fires!",,,,,,,,,,,,,,,,,,,,,,,,,,,,,
"Happy Birthday, Mary!  Here's to fighting fires for another 50 years!",,,,,,,,,,,,,,,,,,,,,,,,,,,,,
"Happy Birthday, Mary!",,,,,,,,,,,,,,,,,,,,,,,,,,,,,
50 years old and still setting off the fire alarm!,,,,,,,,,,,,,,,,,,,,,,,,,,,,,
"If anyone can put out fifty cake candles, it's you, Mary!",,,,,,,,,,,,,,,,,,,,,,,,,,,,,
Proud Mary - Rolling for another 50 years!,,,,,,,,,,,,,,,,,,,,,,,,,,,,,
How many firefighters does it take to put out fifty candles?,,,,,,,,,,,,,,,,,,,,,,,,,,,,,
50 years old and still hot hot hot!,,,,,,,,,,,,,,,,,,,,,,,,,,,,,
"Somebody unplug the fire alarm, because this birthday girl is smokin' hot!",,,,,,,,,,,,,,,,,,,,,,,,,,,,,
Try putting out fifty candles!,,,,,,,,,,,,,,,,,,,,,,,,,,,,,
There's something about Mary...,,,,,,,,,,,,,,,,,,,,,,,,,,,,,
"Baby, you're on fire!",,,,,,,,,,,,,,,,,,,,,,,,,,,,,
"50 isn't old, you're only old when you can't remember your age! Happy birthday!",,,,,,,,,,,,,,,,,,,,,,,,,,,,,
Have a great birthday and keep on smokin'!,,,,,,,,,,,,,,,,,,,,,,,,,,,,,
Better call in the whole department to put out all those candles!,,,,,,,,,,,,,,,,,,,,,,,,,,,,,
You must remember when humans first discovered fire!,,,,,,,,,,,,,,,,,,,,,,,,,,,,,
Best wishes for the next 50 great years!,,,,,,,,,,,,,,,,,,,,,,,,,,,,,
What's that? Can't hear? I said HAVE A GREAT BIRTHDAY MARY!,,,,,,,,,,,,,,,,,,,,,,,,,,,,,
"At 50, you're older than most trees.",,,,,,,,,,,,,,,,,,,,,,,,,,,,,
"Call your buddies out here, cause you're smokin!",,,,,,,,,,,,,,,,,,,,,,,,,,,,,
Happy Birthday Mary! May you always return from your calls.,,,,,,,,,,,,,,,,,,,,,,,,,,,,,
"Remember, blow out the candles on your cake, don't use the hydrant!",,,,,,,,,,,,,,,,,,,,,,,,,,,,,
"We were worried you wouldn't be home on time, so we set your kitchen on fire.",,,,,,,,,,,,,,,,,,,,,,,,,,,,,
Mary's candle of life still burns brightly 50 years later.,,,,,,,,,,,,,,,,,,,,,,,,,,,,,
Have a fiery birthday bash!,,,,,,,,,,,,,,,,,,,,,,,,,,,,,
"Even after 50 years, you're still hot!",,,,,,,,,,,,,,,,,,,,,,,,,,,,,
Welcome to Fifty! We Rock!,,,,,,,,,,,,,,,,,,,,,,,,,,,,,
We thought fifty was old,,,,,,,,,,,,,,,,,,,,,,,,,,,,,
I've always thought you were a hottie!! Happy Birthday!,,,,,,,,,,,,,,,,,,,,,,,,,,,,,
"Love and Happiness to Mary, one of the best!",,,,,,,,,,,,,,,,,,,,,,,,,,,,,
It's a 5 alarm fire!! Mary is 50 today! Wishing you a spectacular birthday!,,,,,,,,,,,,,,,,,,,,,,,,,,,,,
Mary your on Fire. Happy 50th.,,,,,,,,,,,,,,,,,,,,,,,,,,,,,
"Roses are red, fires are too,
Happy birthday to you.",,,,,,,,,,,,,,,,,,,,,,,,,,,,,
"How many firefighters does it take to make a card? We tried, they kept putting it out. Happy b-day.",,,,,,,,,,,,,,,,,,,,,,,,,,,,,
"Happy 50th Marry, let's celebrate.",,,,,,,,,,,,,,,,,,,,,,,,,,,,,
"For the Firefighter who has everything....
Here's some more",,,,,,,,,,,,,,,,,,,,,,,,,,,,,
"50 years in the making and your still standing, happy birthday.",,,,,,,,,,,,,,,,,,,,,,,,,,,,,
Wishing you a fire free day. Happy 50th.,,,,,,,,,,,,,,,,,,,,,,,,,,,,,
Still burning hot,,,,,,,,,,,,,,,,,,,,,,,,,,,,,
Someone pull the fire alarm,,,,,,,,,,,,,,,,,,,,,,,,,,,,,
You're a 50 alarm fire!,,,,,,,,,,,,,,,,,,,,,,,,,,,,,
Hey good lookin',,,,,,,,,,,,,,,,,,,,,,,,,,,,,
Still the brightest flame at 50,,,,,,,,,,,,,,,,,,,,,,,,,,,,,
Hot hot hot,,,,,,,,,,,,,,,,,,,,,,,,,,,,,
May the candles on the cake be the hardest  fire you have to put out,,,,,,,,,,,,,,,,,,,,,,,,,,,,,
You can't put out the fire in her eyes,,,,,,,,,,,,,,,,,,,,,,,,,,,,,
We hope you never get angry with the Sun,,,,,,,,,,,,,,,,,,,,,,,,,,,,,
Are you ever going to retire? You are making  us all look bad!,,,,,,,,,,,,,,,,,,,,,,,,,,,,,
50 HOT YEARS LATER,,,,,,,,,,,,,,,,,,,,,,,,,,,,,
It's been burning for 50 years,,,,,,,,,,,,,,,,,,,,,,,,,,,,,
It's a hot birthday for you!,,,,,,,,,,,,,,,,,,,,,,,,,,,,,
"There's a fire that's been burning for 50 years...

and you still can't put it out!",,,,,,,,,,,,,,,,,,,,,,,,,,,,,
How many fires does it take to kill Mary? None!,,,,,,,,,,,,,,,,,,,,,,,,,,,,,
There's a fire that has been burning steadily for 50 years,,,,,,,,,,,,,,,,,,,,,,,,,,,,,
"With the amount of candles on the cake, we will need to call the fire department!",,,,,,,,,,,,,,,,,,,,,,,,,,,,,
"50 years later, the hottest thing in town is still burning! Happy Birthday Mary!",,,,,,,,,,,,,,,,,,,,,,,,,,,,,
"Mary, Mary, quite contrary ... I forgot the rest, I'm old too.  Happy Birthday, I think?",,,,,,,,,,,,,,,,,,,,,,,,,,,,,
"Still fanning the flames at fifty - you go, hot stuff!",,,,,,,,,,,,,,,,,,,,,,,,,,,,,
by the time you read this i smoked your present. sorry,,,,,,,,,,,,,,,,,,,,,,,,,,,,,
who has a birthday? who cares!,,,,,,,,,,,,,,,,,,,,,,,,,,,,,
happy birthday! want a free dog?,,,,,,,,,,,,,,,,,,,,,,,,,,,,,
"another year, another fart",,,,,,,,,,,,,,,,,,,,,,,,,,,,,
happy birthday! i didnt sign this so you can re-gift it,,,,,,,,,,,,,,,,,,,,,,,,,,,,,
lets try something new for your birthday this year-having sex,,,,,,,,,,,,,,,,,,,,,,,,,,,,,
half a century on heart fire !,,,,,,,,,,,,,,,,,,,,,,,,,,,,,
"I am glad most of your friends are firefighters, they can help you with those candles",,,,,,,,,,,,,,,,,,,,,,,,,,,,,
"Mary you are 50, 50 candles ! I am glad you are used to ""big fires""",,,,,,,,,,,,,,,,,,,,,,,,,,,,,
"I was there, it is no painful at all",,,,,,,,,,,,,,,,,,,,,,,,,,,,,
"you do not look like 50 at all, I may become a firefighter myself, maybe that is your secret",,,,,,,,,,,,,,,,,,,,,,,,,,,,,
"go girl, go  !!it is only 50 !!",,,,,,,,,,,,,,,,,,,,,,,,,,,,,
Will the fire department be called to put out your birthday cake?,,,,,,,,,,,,,,,,,,,,,,,,,,,,,
"Fiery, Fiery, guess who's Fifty",,,,,,,,,,,,,,,,,,,,,,,,,,,,,
You didn't start the fire...,,,,,,,,,,,,,,,,,,,,,,,,,,,,,
Hotty Birthday,,,,,,,,,,,,,,,,,,,,,,,,,,,,,
50 and still you have fire!,,,,,,,,,,,,,,,,,,,,,,,,,,,,,
"5 decades, 5 steps on a stepladder",,,,,,,,,,,,,,,,,,,,,,,,,,,,,
Don't let your 50 candles start a fire at the firestation!,,,,,,,,,,,,,,,,,,,,,,,,,,,,,
You are on fire birthday girl!,,,,,,,,,,,,,,,,,,,,,,,,,,,,,
You're hotter than ever!,,,,,,,,,,,,,,,,,,,,,,,,,,,,,
It'll take more than one fireman to put out 50 candles,,,,,,,,,,,,,,,,,,,,,,,,,,,,,
Happy Birthday!  Just 50 more to the big 100!,,,,,,,,,,,,,,,,,,,,,,,,,,,,,
Happy Birthday!  Hope your day is too Hot to handle!,,,,,,,,,,,,,,,,,,,,,,,,,,,,,
Happy Birthday!  Have a Roaring good time!,,,,,,,,,,,,,,,,,,,,,,,,,,,,,
Your birthday is a time for celebration. Happy birthday,,,,,,,,,,,,,,,,,,,,,,,,,,,,,
Happy Birthday to a brave soul!,,,,,,,,,,,,,,,,,,,,,,,,,,,,,
"You're one year older now, make this new year the most marvelous one yet.",,,,,,,,,,,,,,,,,,,,,,,,,,,,,
Take a crazy ride down the firefighter pole for me on the big 5-0,,,,,,,,,,,,,,,,,,,,,,,,,,,,,
A Happy Birthday to the best firefighter the world. You're amazing.,,,,,,,,,,,,,,,,,,,,,,,,,,,,,
Happy Birthday Mary! I hope your day is as amazing as you are and you have many more like it.,,,,,,,,,,,,,,,,,,,,,,,,,,,,,
Happy Birthday Mary. You're brighter than the blazing fires you put out. Never stop shining.,,,,,,,,,,,,,,,,,,,,,,,,,,,,,
the community is proud to have someone like you serving on the Fire Dept.    A very happy birthday to you.,,,,,,,,,,,,,,,,,,,,,,,,,,,,,
Keep putting out those fires,,,,,,,,,,,,,,,,,,,,,,,,,,,,,
enjoy your big day.  you're a special person.,,,,,,,,,,,,,,,,,,,,,,,,,,,,,
"you won't need a fire extinguisher to put out all those birthday candles (I think).
You're great; happy birthday",,,,,,,,,,,,,,,,,,,,,,,,,,,,,
i always feel safe knowing you're on the fire dept.  Please enjoy your day,,,,,,,,,,,,,,,,,,,,,,,,,,,,,
I have always admired you.  Please have a great birthday.,,,,,,,,,,,,,,,,,,,,,,,,,,,,,
Your fire is only 50% contained!,,,,,,,,,,,,,,,,,,,,,,,,,,,,,
You'll need a bigger hose to put out these 50 candles!,,,,,,,,,,,,,,,,,,,,,,,,,,,,,
50 and the fire is still going!,,,,,,,,,,,,,,,,,,,,,,,,,,,,,
"Mary, It's a 5 alarm birthday!",,,,,,,,,,,,,,,,,,,,,,,,,,,,,
Over the hill? Not yet!,,,,,,,,,,,,,,,,,,,,,,,,,,,,,
"Keep on living life to the fullest, Happy Birthday!",,,,,,,,,,,,,,,,,,,,,,,,,,,,,
You are a fire that isn't ready to be put out. Happy Birthday Mary!,,,,,,,,,,,,,,,,,,,,,,,,,,,,,
Mary you are a fire that keeps burning brighter. Happy Birthday!,,,,,,,,,,,,,,,,,,,,,,,,,,,,,
I hope that you have a great 50th birthday and that you have many more to come. Happy Birthday!,,,,,,,,,,,,,,,,,,,,,,,,,,,,,
Hope you have a 50th birthday that is on Fire,,,,,,,,,,,,,,,,,,,,,,,,,,,,,
Happy Birthday Mary,,,,,,,,,,,,,,,,,,,,,,,,,,,,,
May this day be a special a birthday as you have always wanted. Enjoy you day and do something special for you 50 year old.,,,,,,,,,,,,,,,,,,,,,,,,,,,,,
Another birthday and you are still looking good at an age when many are not so fortunate. Have a very special day as you celebrate your 50th.,,,,,,,,,,,,,,,,,,,,,,,,,,,,,
Happy birthday to the hottest firefighter in the station house. May your 50th be far better then the 49 previous birthdays. Feel special today and do something nice for yourself.,,,,,,,,,,,,,,,,,,,,,,,,,,,,,
"Wow, double 25 and still kicking. You should be proud and you should go have a day only a firefighter can enjoy. Happy birthday.",,,,,,,,,,,,,,,,,,,,,,,,,,,,,
Happy Birthday u r now 50,,,,,,,,,,,,,,,,,,,,,,,,,,,,,
Fire fighter 5 0s Birthday,,,,,,,,,,,,,,,,,,,,,,,,,,,,,
50 Degrees Fahrenheit or 50 years old?,,,,,,,,,,,,,,,,,,,,,,,,,,,,,
Is it me or are you on fire for 50,,,,,,,,,,,,,,,,,,,,,,,,,,,,,
"Don't worry its just 50 candles, Happy 50th birthday",,,,,,,,,,,,,,,,,,,,,,,,,,,,,
Its getting hot in here and you're turning 50,,,,,,,,,,,,,,,,,,,,,,,,,,,,,
50 almost half way there,,,,,,,,,,,,,,,,,,,,,,,,,,,,,
"50 candles, we might need the fire extinguisher, Happy 50th",,,,,,,,,,,,,,,,,,,,,,,,,,,,,
Happy Birthday to the greatest firefighter in the world.,,,,,,,,,,,,,,,,,,,,,,,,,,,,,
You're special. Happy Birthday.,,,,,,,,,,,,,,,,,,,,,,,,,,,,,
"Happy Birthday to the sweetest person alive!

Dear Mary, Happy Birthday and may all your wishes come true.

Happy Birthday to the greatest firefighter in the world.

Happy Birthday to most special person who served the nation.",,,,,,,,,,,,,,,,,,,,,,,,,,,,,
Happy Birthday and may all your wishes come true.,,,,,,,,,,,,,,,,,,,,,,,,,,,,,
"You're 50 now, time to start living!",,,,,,,,,,,,,,,,,,,,,,,,,,,,,
Here's to the a great 50th birthday.,,,,,,,,,,,,,,,,,,,,,,,,,,,,,
Best wishes on your 50th birthday.,,,,,,,,,,,,,,,,,,,,,,,,,,,,,
Have a great birthday hot stuff!,,,,,,,,,,,,,,,,,,,,,,,,,,,,,
Happy birthday!,,,,,,,,,,,,,,,,,,,,,,,,,,,,,
"Have a blazin day
You are still smoking hot for 50
You are one hot mama
You are flaming hot",,,,,,,,,,,,,,,,,,,,,,,,,,,,,
It's getting hot in here! Happy 50th!,,,,,,,,,,,,,,,,,,,,,,,,,,,,,
This birthday is on fire!,,,,,,,,,,,,,,,,,,,,,,,,,,,,,
Happy 50th to a wonderful firefighter!,,,,,,,,,,,,,,,,,,,,,,,,,,,,,
"The say you are over the hill, but then they have never walked into a burning building. Happy 50th Mary!",,,,,,,,,,,,,,,,,,,,,,,,,,,,,
A special birthday for a very special person. Happy 50!,,,,,,,,,,,,,,,,,,,,,,,,,,,,,
Happy birthday hottie!,,,,,,,,,,,,,,,,,,,,,,,,,,,,,
You made it another year! Happy 50th birthday Mary,,,,,,,,,,,,,,,,,,,,,,,,,,,,,
"Fighting Fires at 50, Fit as a Fiddle!",,,,,,,,,,,,,,,,,,,,,,,,,,,,,
"Unique and Helpful, You Deserve a Happy Birthday!",,,,,,,,,,,,,,,,,,,,,,,,,,,,,
Happy Birthday!,,,,,,,,,,,,,,,,,,,,,,,,,,,,,
Don't Flame Out Yet.  Happy 50th Mary!,,,,,,,,,,,,,,,,,,,,,,,,,,,,,
Time to Celebrate!,,,,,,,,,,,,,,,,,,,,,,,,,,,,,
Happy 50th Birthday!,,,,,,,,,,,,,,,,,,,,,,,,,,,,,
"Happy Birthday, Mary!",,,,,,,,,,,,,,,,,,,,,,,,,,,,,
50 is the new 30!,,,,,,,,,,,,,,,,,,,,,,,,,,,,,
Enjoy the Spark of Life!,,,,,,,,,,,,,,,,,,,,,,,,,,,,,
Welcome to the Big 5-0,,,,,,,,,,,,,,,,,,,,,,,,,,,,,
Looks Like You Are Having a Five Alarm Birthday,,,,,,,,,,,,,,,,,,,,,,,,,,,,,
Turn 50 Isn't Great But It's Better than the Alternative,,,,,,,,,,,,,,,,,,,,,,,,,,,,,
Happy 29th Birthday....Agian,,,,,,,,,,,,,,,,,,,,,,,,,,,,,
"Happy Birthday, Old Fart?",,,,,,,,,,,,,,,,,,,,,,,,,,,,,
It's time to PARTY!,,,,,,,,,,,,,,,,,,,,,,,,,,,,,
You're only getting older!,,,,,,,,,,,,,,,,,,,,,,,,,,,,,
What day is it? Oh it's just your birthday.,,,,,,,,,,,,,,,,,,,,,,,,,,,,,
Hope today is as great as last year's birthday!,,,,,,,,,,,,,,,,,,,,,,,,,,,,,
Happy birthday to a winner!,,,,,,,,,,,,,,,,,,,,,,,,,,,,,
It's your birthday and you deserve a card!,,,,,,,,,,,,,,,,,,,,,,,,,,,,,
50 is the new 21! Happy Birthday Mary!,,,,,,,,,,,,,,,,,,,,,,,,,,,,,
50 and fighting fires! Happy Birthday Mary!,,,,,,,,,,,,,,,,,,,,,,,,,,,,,
Fifty is Fabulous!,,,,,,,,,,,,,,,,,,,,,,,,,,,,,
"You're so hot on your birthday, we need to spray you down!",,,,,,,,,,,,,,,,,,,,,,,,,,,,,
"Mary, you're on fire! Happy Birthday!",,,,,,,,,,,,,,,,,,,,,,,,,,,,,
Have a hot birthday!,,,,,,,,,,,,,,,,,,,,,,,,,,,,,
"Mary is so hot on her 50th, she's setting off all of the sirens!",,,,,,,,,,,,,,,,,,,,,,,,,,,,,
"Hot damn, Mary is 50!",,,,,,,,,,,,,,,,,,,,,,,,,,,,,
Happy Birthday to a Hero!,,,,,,,,,,,,,,,,,,,,,,,,,,,,,
Have a smoking hot birthday!!!!,,,,,,,,,,,,,,,,,,,,,,,,,,,,,
"Hop on the truck Mary, the next fifty will be a race!!",,,,,,,,,,,,,,,,,,,,,,,,,,,,,
Still looking hot Mary!!! Happy Birthday,,,,,,,,,,,,,,,,,,,,,,,,,,,,,
You are a hero for many people. Happy Birthday,,,,,,,,,,,,,,,,,,,,,,,,,,,,,
Many people will thinking about you on your BD. Happy birthday!,,,,,,,,,,,,,,,,,,,,,,,,,,,,,
You are my hero. I am not here today because of you. Happy birthday.,,,,,,,,,,,,,,,,,,,,,,,,,,,,,
"Do you feel regret of being firefighter, I do not think so. Happy BD!",,,,,,,,,,,,,,,,,,,,,,,,,,,,,
Looks like you finally make it to the five 0. Happy BD,,,,,,,,,,,,,,,,,,,,,,,,,,,,,
Thank you for being there for us. Happy BD,,,,,,,,,,,,,,,,,,,,,,,,,,,,,
"Wow, happy BD, you almost make it",,,,,,,,,,,,,,,,,,,,,,,,,,,,,
Happy Birthday to my flame,,,,,,,,,,,,,,,,,,,,,,,,,,,,,
Happy Birthday to my life saver,,,,,,,,,,,,,,,,,,,,,,,,,,,,,
Happy Birthday to my constant flame,,,,,,,,,,,,,,,,,,,,,,,,,,,,,
Happy Birthday to my Hottie,,,,,,,,,,,,,,,,,,,,,,,,,,,,,
happy birthday to the toughest lady I know,,,,,,,,,,,,,,,,,,,,,,,,,,,,,
Happy birthday to a lady on fire,,,,,,,,,,,,,,,,,,,,,,,,,,,,,
Happy Birthday you are en fuego,,,,,,,,,,,,,,,,,,,,,,,,,,,,,
Happy Birthday to my Hero,,,,,,,,,,,,,,,,,,,,,,,,,,,,,
Ahh the burning passion of youth! Happy birthday!,,,,,,,,,,,,,,,,,,,,,,,,,,,,,
Somedays you just want to slide back up the pole. Heres to hoping today isn't one of them. Happy Birthday Mary!,,,,,,,,,,,,,,,,,,,,,,,,,,,,,
There is a raging fire that needs to be put out! Oh thats just the candles on your Birthday cake! Happy Birthday Mary!,,,,,,,,,,,,,,,,,,,,,,,,,,,,,
"When it comes to lighting up a fire, its a sure thing that with 50 candles on the cake, you will start a huge one!  Happy birthday!",,,,,,,,,,,,,,,,,,,,,,,,,,,,,
"50, its just a number, dont let it burn you up!  Happy birthday!",,,,,,,,,,,,,,,,,,,,,,,,,,,,,
Dont get all fired up over this 50th birthday!  Just put it out and enjoy old age!  Happy birthday!,,,,,,,,,,,,,,,,,,,,,,,,,,,,,
"Some may say that 50 is old, while others may say that 50 is young, well in your world, 50 is for sure fire young!  Happy Birthday!",,,,,,,,,,,,,,,,,,,,,,,,,,,,,
"Once upon a time a 50 year old firefighter was climbing a ladder to the second floor to fight the flames.  Then her body said, whoa, you are 50, and down the ladder she fell.  Then she realized that 50 was a bitch!  Happy Birthday!",,,,,,,,,,,,,,,,,,,,,,,,,,,,,
"Although you put out flames for a living, at 50, life is about to put out your flames!  Just kidding, happy birthday!",,,,,,,,,,,,,,,,,,,,,,,,,,,,,
"Most fires are put out fast, but your fire for life has lasted 50 years!  Happy Birthday!",,,,,,,,,,,,,,,,,,,,,,,,,,,,,
Your really light my fire! Happy Birthday!,,,,,,,,,,,,,,,,,,,,,,,,,,,,,
You are still burning bright at 50. Have a Happy Birthday!,,,,,,,,,,,,,,,,,,,,,,,,,,,,,
Hope your birthday brings you warm memories.,,,,,,,,,,,,,,,,,,,,,,,,,,,,,
Now you can begin the second half of your life. Have a Happy Birthday!,,,,,,,,,,,,,,,,,,,,,,,,,,,,,
You are still hot at 50. Have a Happy Birthday!,,,,,,,,,,,,,,,,,,,,,,,,,,,,,
Hope you enjoy having many candles to put out!  Happy Birthday!,,,,,,,,,,,,,,,,,,,,,,,,,,,,,
"There are many candles on your birthday, it's going to need a hose to blow it out! Happy Birthday!",,,,,,,,,,,,,,,,,,,,,,,,,,,,,
I found this card about fires and thought you could light it up and then blow it out.,,,,,,,,,,,,,,,,,,,,,,,,,,,,,
A hot birthday coming up!  Have fun hosing it down!,,,,,,,,,,,,,,,,,,,,,,,,,,,,,
A big 5 - 0 on your birthday?  Don't burn down the house with your cake!  Happy Birthday!,,,,,,,,,,,,,,,,,,,,,,,,,,,,,
Mary Mary had a little fire hose. Happy birthday,,,,,,,,,,,,,,,,,,,,,,,,,,,,,
Sending you best wishes and a virtual fire truck. Happy birthday.,,,,,,,,,,,,,,,,,,,,,,,,,,,,,
Welcome to the better half of your life.  You will love this part,,,,,,,,,,,,,,,,,,,,,,,,,,,,,
"At fifty, you are still able to slide down that pole, happy birthday",,,,,,,,,,,,,,,,,,,,,,,,,,,,,
"To the woman who should play Catwoman in the upcoming Batman movie, Happy Birthday!",,,,,,,,,,,,,,,,,,,,,,,,,,,,,
"To someone who is not old enough to be a grandmother, Happy Birthday!",,,,,,,,,,,,,,,,,,,,,,,,,,,,,
"Most
Attractive
Ragin'
Young

Happy Birthday",,,,,,,,,,,,,,,,,,,,,,,,,,,,,
I wish you a whale of a good time on your birthday,,,,,,,,,,,,,,,,,,,,,,,,,,,,,
"Happy Birthday to MARY, the girl on FIRE",,,,,,,,,,,,,,,,,,,,,,,,,,,,,
50 is the new fabulous,,,,,,,,,,,,,,,,,,,,,,,,,,,,,
the next fifty are even better !,,,,,,,,,,,,,,,,,,,,,,,,,,,,,
we're burning with love for you !,,,,,,,,,,,,,,,,,,,,,,,,,,,,,
life begins at fifty!,,,,,,,,,,,,,,,,,,,,,,,,,,,,,
Happy Birthday,,,,,,,,,,,,,,,,,,,,,,,,,,,,,
Here's to another blazing half century,,,,,,,,,,,,,,,,,,,,,,,,,,,,,
Hope you have a hot birthday,,,,,,,,,,,,,,,,,,,,,,,,,,,,,
"Have a nice birthday. Sorry about BURNING you on the cheap gift, but I was broke.",,,,,,,,,,,,,,,,,,,,,,,,,,,,,
50 isn't that old really,,,,,,,,,,,,,,,,,,,,,,,,,,,,,
Time to extinguish all your birthday candles!,,,,,,,,,,,,,,,,,,,,,,,,,,,,,
"Sound the alarm, it's Mary's birthday!",,,,,,,,,,,,,,,,,,,,,,,,,,,,,
Congrats to another year of being a fire hazard!,,,,,,,,,,,,,,,,,,,,,,,,,,,,,
Sound the alarm!,,,,,,,,,,,,,,,,,,,,,,,,,,,,,
Here's to another blazing good year!,,,,,,,,,,,,,,,,,,,,,,,,,,,,,
Watch out now! Mary's on fire!,,,,,,,,,,,,,,,,,,,,,,,,,,,,,
What's the view like from up there?,,,,,,,,,,,,,,,,,,,,,,,,,,,,,
It's time for another HOT birthday!,,,,,,,,,,,,,,,,,,,,,,,,,,,,,
Time for Mary to start rolling down the hill!,,,,,,,,,,,,,,,,,,,,,,,,,,,,,
Will 50 candles start a fire?,,,,,,,,,,,,,,,,,,,,,,,,,,,,,
50 years of being the good Mary from the bible.,,,,,,,,,,,,,,,,,,,,,,,,,,,,,
50 and ticking. I hope your fire inside never goes out.,,,,,,,,,,,,,,,,,,,,,,,,,,,,,
50 years of hotness and the fire is still burning!,,,,,,,,,,,,,,,,,,,,,,,,,,,,,
